2025-11-21 23:14:56,837 - INFO - Successfully connected to Odoo as apichart@mogen.co.th
2025-11-21 23:14:56,838 - INFO - 
================================================================================
2025-11-21 23:14:56,838 - INFO - Starting import from: Import_PO/Template_PO_new.xlsx
2025-11-21 23:14:56,838 - INFO - Dry-run mode: False
2025-11-21 23:14:56,838 - INFO - ================================================================================
2025-11-21 23:14:57,031 - INFO - ✓ Excel file loaded: 298 total rows
2025-11-21 23:14:57,032 - INFO - ✓ All required columns found
2025-11-21 23:14:57,034 - INFO - ✓ Found 126 purchase orders to process
2025-11-21 23:14:57,034 - INFO - --------------------------------------------------------------------------------
2025-11-21 23:14:57,035 - INFO - [1/126] Processing PO: BPD-6700364 (2 lines)
2025-11-21 23:15:07,458 - INFO - Found tax by amount: 0.0 -> ID 5
2025-11-21 23:15:07,891 - INFO - Found tax by amount: 0.0 -> ID 5
2025-11-21 23:15:08,184 - INFO - Created PO BPD-6700364 with ID 1
2025-11-21 23:15:08,184 - INFO -   ✓ Created PO BPD-6700364 with ID 1
2025-11-21 23:15:08,184 - INFO - [2/126] Processing PO: BPD-6800308 (1 lines)
2025-11-21 23:15:08,894 - INFO - Using picking_type_id: คลังวัตถุดิบ 2: Receipts (ID: 131)
2025-11-21 23:15:09,590 - INFO - Found tax by amount*100: 7.000000000000001 -> ID 3
2025-11-21 23:15:10,083 - INFO - Created PO BPD-6800308 with ID 2
2025-11-21 23:15:10,083 - INFO -   ✓ Created PO BPD-6800308 with ID 2
2025-11-21 23:15:10,084 - INFO - [3/126] Processing PO: BPD-6800383 (1 lines)
2025-11-21 23:15:10,836 - INFO - Using picking_type_id: คลังวัตถุดิบ 2: Receipts (ID: 131)
2025-11-21 23:15:11,448 - INFO - Found tax by amount*100: 7.000000000000001 -> ID 3
2025-11-21 23:15:11,661 - INFO - Created PO BPD-6800383 with ID 3
2025-11-21 23:15:11,661 - INFO -   ✓ Created PO BPD-6800383 with ID 3
2025-11-21 23:15:11,661 - INFO - [4/126] Processing PO: BPD-6800603 (3 lines)
2025-11-21 23:15:12,406 - INFO - Using picking_type_id: คลังวัตถุดิบ 2: Receipts (ID: 131)
2025-11-21 23:15:13,333 - INFO - Found tax by amount*100: 7.000000000000001 -> ID 3
2025-11-21 23:15:14,090 - INFO - Found tax by amount*100: 7.000000000000001 -> ID 3
2025-11-21 23:15:14,691 - INFO - Found tax by amount*100: 7.000000000000001 -> ID 3
2025-11-21 23:15:15,095 - INFO - Created PO BPD-6800603 with ID 4
2025-11-21 23:15:15,095 - INFO -   ✓ Created PO BPD-6800603 with ID 4
2025-11-21 23:15:15,096 - INFO - [5/126] Processing PO: BPD-6800833 (1 lines)
2025-11-21 23:15:15,948 - INFO - Using picking_type_id: คลังวัตถุดิบ 2: Receipts (ID: 131)
2025-11-21 23:15:16,569 - INFO - Found tax by amount*100: 7.000000000000001 -> ID 3
2025-11-21 23:15:16,793 - INFO - Created PO BPD-6800833 with ID 5
2025-11-21 23:15:16,793 - INFO -   ✓ Created PO BPD-6800833 with ID 5
2025-11-21 23:15:16,793 - INFO - [6/126] Processing PO: BPD-6800859 (2 lines)
2025-11-21 23:15:17,671 - INFO - Using picking_type_id: คลังวัตถุดิบ 2: Receipts (ID: 131)
2025-11-21 23:15:18,430 - INFO - Found tax by amount*100: 7.000000000000001 -> ID 3
2025-11-21 23:15:19,001 - INFO - Found tax by amount*100: 7.000000000000001 -> ID 3
2025-11-21 23:15:19,228 - INFO - Created PO BPD-6800859 with ID 6
2025-11-21 23:15:19,228 - INFO -   ✓ Created PO BPD-6800859 with ID 6
2025-11-21 23:15:19,229 - INFO - [7/126] Processing PO: BPD-6800865 (5 lines)
2025-11-21 23:15:20,063 - INFO - Using picking_type_id: คลังวัตถุดิบ 2: Receipts (ID: 131)
2025-11-21 23:15:20,814 - INFO - Found tax by amount*100: 7.000000000000001 -> ID 3
2025-11-21 23:15:22,022 - INFO - Found tax by amount*100: 7.000000000000001 -> ID 3
2025-11-21 23:15:22,589 - INFO - Found tax by amount*100: 7.000000000000001 -> ID 3
2025-11-21 23:15:23,172 - INFO - Found tax by amount*100: 7.000000000000001 -> ID 3
2025-11-21 23:15:23,751 - INFO - Found tax by amount*100: 7.000000000000001 -> ID 3
2025-11-21 23:15:24,008 - INFO - Created PO BPD-6800865 with ID 7
2025-11-21 23:15:24,009 - INFO -   ✓ Created PO BPD-6800865 with ID 7
2025-11-21 23:15:24,009 - INFO - [8/126] Processing PO: BPD-6800867 (1 lines)
2025-11-21 23:15:24,664 - INFO - Using picking_type_id: คลังวัตถุดิบ 2: Receipts (ID: 131)
2025-11-21 23:15:25,279 - INFO - Found tax by amount*100: 7.000000000000001 -> ID 3
2025-11-21 23:15:25,480 - INFO - Created PO BPD-6800867 with ID 8
2025-11-21 23:15:25,481 - INFO -   ✓ Created PO BPD-6800867 with ID 8
2025-11-21 23:15:25,481 - INFO - [9/126] Processing PO: BPD-6800872 (1 lines)
2025-11-21 23:15:26,163 - INFO - Using picking_type_id: คลังสิ้นเปลืองโรงงาน: Receipts (ID: 181)
2025-11-21 23:15:26,807 - INFO - Found tax by amount*100: 7.000000000000001 -> ID 3
2025-11-21 23:15:27,009 - INFO - Created PO BPD-6800872 with ID 9
2025-11-21 23:15:27,009 - INFO -   ✓ Created PO BPD-6800872 with ID 9
2025-11-21 23:15:27,010 - INFO - [10/126] Processing PO: BPD-6800873 (1 lines)
2025-11-21 23:15:27,807 - INFO - Using picking_type_id: คลังสิ้นเปลืองโรงงาน: Receipts (ID: 181)
2025-11-21 23:15:28,199 - INFO - Found tax by amount: 0.0 -> ID 5
2025-11-21 23:15:28,473 - INFO - Created PO BPD-6800873 with ID 10
2025-11-21 23:15:28,474 - INFO -   ✓ Created PO BPD-6800873 with ID 10
2025-11-21 23:15:28,474 - INFO - [11/126] Processing PO: BPD-6800876 (3 lines)
2025-11-21 23:15:29,190 - INFO - Using picking_type_id: คลังวัตถุดิบ 2: Receipts (ID: 131)
2025-11-21 23:15:29,757 - INFO - Found tax by amount*100: 7.000000000000001 -> ID 3
2025-11-21 23:15:30,427 - INFO - Found tax by amount*100: 7.000000000000001 -> ID 3
2025-11-21 23:15:31,113 - INFO - Found tax by amount*100: 7.000000000000001 -> ID 3
2025-11-21 23:15:31,420 - INFO - Created PO BPD-6800876 with ID 11
2025-11-21 23:15:31,421 - INFO -   ✓ Created PO BPD-6800876 with ID 11
2025-11-21 23:15:31,421 - INFO - [12/126] Processing PO: BPO-6700023 (1 lines)
2025-11-21 23:15:33,119 - INFO - Found tax by amount: 0.0 -> ID 5
2025-11-21 23:15:33,329 - INFO - Created PO BPO-6700023 with ID 12
2025-11-21 23:15:33,330 - INFO -   ✓ Created PO BPO-6700023 with ID 12
2025-11-21 23:15:33,330 - INFO - [13/126] Processing PO: BPO-6700107 (9 lines)
2025-11-21 23:15:34,800 - INFO - Found tax by amount: 0.0 -> ID 5
2025-11-21 23:15:35,256 - INFO - Found tax by amount: 0.0 -> ID 5
2025-11-21 23:15:35,864 - INFO - Found tax by amount: 0.0 -> ID 5
2025-11-21 23:15:37,552 - INFO - Found tax by amount: 0.0 -> ID 5
2025-11-21 23:15:38,080 - INFO - Found tax by amount: 0.0 -> ID 5
2025-11-21 23:15:38,563 - INFO - Found tax by amount: 0.0 -> ID 5
2025-11-21 23:15:39,174 - INFO - Found tax by amount: 0.0 -> ID 5
2025-11-21 23:15:39,690 - INFO - Found tax by amount: 0.0 -> ID 5
2025-11-21 23:15:40,170 - INFO - Found tax by amount: 0.0 -> ID 5
2025-11-21 23:15:40,418 - INFO - Created PO BPO-6700107 with ID 13
2025-11-21 23:15:40,418 - INFO -   ✓ Created PO BPO-6700107 with ID 13
2025-11-21 23:15:40,419 - INFO - [14/126] Processing PO: BPO-6700132 (2 lines)
2025-11-21 23:15:41,830 - INFO - Found tax by amount: 0.0 -> ID 5
2025-11-21 23:15:42,351 - INFO - Found tax by amount: 0.0 -> ID 5
2025-11-21 23:15:42,564 - INFO - Created PO BPO-6700132 with ID 14
2025-11-21 23:15:42,564 - INFO -   ✓ Created PO BPO-6700132 with ID 14
2025-11-21 23:15:42,565 - INFO - [15/126] Processing PO: BPO-6700155 (7 lines)
2025-11-21 23:15:44,231 - INFO - Found tax by amount: 0.0 -> ID 5
2025-11-21 23:15:44,857 - INFO - Found tax by amount: 0.0 -> ID 5
2025-11-21 23:15:45,575 - INFO - Found tax by amount: 0.0 -> ID 5
2025-11-21 23:15:46,103 - INFO - Found tax by amount: 0.0 -> ID 5
2025-11-21 23:15:46,692 - INFO - Found tax by amount: 0.0 -> ID 5
2025-11-21 23:15:47,163 - INFO - Found tax by amount: 0.0 -> ID 5
2025-11-21 23:15:47,615 - INFO - Found tax by amount: 0.0 -> ID 5
2025-11-21 23:15:47,864 - INFO - Created PO BPO-6700155 with ID 15
2025-11-21 23:15:47,864 - INFO -   ✓ Created PO BPO-6700155 with ID 15
2025-11-21 23:15:47,865 - INFO - [16/126] Processing PO: BPO-6700156 (1 lines)
2025-11-21 23:15:49,324 - INFO - Found tax by amount: 0.0 -> ID 5
2025-11-21 23:15:49,920 - INFO - Created PO BPO-6700156 with ID 16
2025-11-21 23:15:49,920 - INFO -   ✓ Created PO BPO-6700156 with ID 16
2025-11-21 23:15:49,921 - INFO - [17/126] Processing PO: BPO-6700214 (2 lines)
2025-11-21 23:15:51,981 - INFO - Found tax by amount: 0.0 -> ID 5
2025-11-21 23:15:52,498 - INFO - Found tax by amount: 0.0 -> ID 5
2025-11-21 23:15:52,718 - INFO - Created PO BPO-6700214 with ID 17
2025-11-21 23:15:52,719 - INFO -   ✓ Created PO BPO-6700214 with ID 17
2025-11-21 23:15:52,719 - INFO - [18/126] Processing PO: BPO-6700314 (7 lines)
2025-11-21 23:15:54,925 - INFO - Found tax by amount: 0.0 -> ID 5
2025-11-21 23:15:55,442 - INFO - Found tax by amount: 0.0 -> ID 5
2025-11-21 23:15:56,450 - INFO - Found tax by amount: 0.0 -> ID 5
2025-11-21 23:15:57,502 - INFO - Found tax by amount: 0.0 -> ID 5
2025-11-21 23:15:58,263 - INFO - Found tax by amount: 0.0 -> ID 5
2025-11-21 23:15:59,312 - INFO - Found tax by amount: 0.0 -> ID 5
2025-11-21 23:16:00,111 - INFO - Found tax by amount: 0.0 -> ID 5
2025-11-21 23:16:00,390 - INFO - Created PO BPO-6700314 with ID 18
2025-11-21 23:16:00,390 - INFO -   ✓ Created PO BPO-6700314 with ID 18
2025-11-21 23:16:00,391 - INFO - [19/126] Processing PO: BPO-6800003 (1 lines)
2025-11-21 23:16:02,557 - INFO - Found tax by amount*100: 7.000000000000001 -> ID 3
2025-11-21 23:16:03,030 - INFO - Created PO BPO-6800003 with ID 19
2025-11-21 23:16:03,031 - INFO -   ✓ Created PO BPO-6800003 with ID 19
2025-11-21 23:16:03,031 - INFO - [20/126] Processing PO: BPO-6800005 (1 lines)
2025-11-21 23:16:04,664 - INFO - Found tax by amount: 0.0 -> ID 5
2025-11-21 23:16:04,894 - INFO - Created PO BPO-6800005 with ID 20
2025-11-21 23:16:04,895 - INFO -   ✓ Created PO BPO-6800005 with ID 20
2025-11-21 23:16:04,895 - INFO - [21/126] Processing PO: BPO-6800045 (2 lines)
2025-11-21 23:16:07,126 - INFO - Found tax by amount: 0.0 -> ID 5
2025-11-21 23:16:07,850 - INFO - Found tax by amount: 0.0 -> ID 5
2025-11-21 23:16:08,552 - INFO - Created PO BPO-6800045 with ID 21
2025-11-21 23:16:08,552 - INFO -   ✓ Created PO BPO-6800045 with ID 21
2025-11-21 23:16:08,552 - INFO - [22/126] Processing PO: BPO-6800046 (2 lines)
2025-11-21 23:16:10,730 - INFO - Found tax by amount: 0.0 -> ID 5
2025-11-21 23:16:11,358 - INFO - Found tax by amount: 0.0 -> ID 5
2025-11-21 23:16:11,586 - INFO - Created PO BPO-6800046 with ID 22
2025-11-21 23:16:11,586 - INFO -   ✓ Created PO BPO-6800046 with ID 22
2025-11-21 23:16:11,587 - INFO - [23/126] Processing PO: BPO-6800055 (5 lines)
2025-11-21 23:16:12,991 - INFO - Found tax by amount: 0.0 -> ID 5
2025-11-21 23:16:13,460 - INFO - Found tax by amount: 0.0 -> ID 5
2025-11-21 23:16:13,949 - INFO - Found tax by amount: 0.0 -> ID 5
2025-11-21 23:16:14,417 - INFO - Found tax by amount: 0.0 -> ID 5
2025-11-21 23:16:14,892 - INFO - Found tax by amount: 0.0 -> ID 5
2025-11-21 23:16:15,121 - INFO - Created PO BPO-6800055 with ID 23
2025-11-21 23:16:15,121 - INFO -   ✓ Created PO BPO-6800055 with ID 23
2025-11-21 23:16:15,122 - INFO - [24/126] Processing PO: BPO-6800071 (3 lines)
2025-11-21 23:16:17,013 - INFO - Found tax by amount*100: 7.000000000000001 -> ID 3
2025-11-21 23:16:17,548 - INFO - Found tax by amount*100: 7.000000000000001 -> ID 3
2025-11-21 23:16:18,168 - INFO - Found tax by amount*100: 7.000000000000001 -> ID 3
2025-11-21 23:16:18,409 - INFO - Created PO BPO-6800071 with ID 24
2025-11-21 23:16:18,410 - INFO -   ✓ Created PO BPO-6800071 with ID 24
2025-11-21 23:16:18,410 - INFO - [25/126] Processing PO: BPO-6800097 (7 lines)
2025-11-21 23:16:20,025 - INFO - Found tax by amount: 0.0 -> ID 5
2025-11-21 23:16:20,681 - INFO - Found tax by amount: 0.0 -> ID 5
2025-11-21 23:16:21,439 - INFO - Found tax by amount: 0.0 -> ID 5
2025-11-21 23:16:22,291 - INFO - Found tax by amount: 0.0 -> ID 5
2025-11-21 23:16:22,819 - INFO - Found tax by amount: 0.0 -> ID 5
2025-11-21 23:16:23,388 - INFO - Found tax by amount: 0.0 -> ID 5
2025-11-21 23:16:23,940 - INFO - Found tax by amount: 0.0 -> ID 5
2025-11-21 23:16:24,526 - INFO - Created PO BPO-6800097 with ID 25
2025-11-21 23:16:24,527 - INFO -   ✓ Created PO BPO-6800097 with ID 25
2025-11-21 23:16:24,527 - INFO - [26/126] Processing PO: BPO-6800115 (7 lines)
2025-11-21 23:16:26,066 - INFO - Found tax by amount: 0.0 -> ID 5
2025-11-21 23:16:26,536 - INFO - Found tax by amount: 0.0 -> ID 5
2025-11-21 23:16:27,054 - INFO - Found tax by amount: 0.0 -> ID 5
2025-11-21 23:16:27,578 - INFO - Found tax by amount: 0.0 -> ID 5
2025-11-21 23:16:28,049 - INFO - Found tax by amount: 0.0 -> ID 5
2025-11-21 23:16:28,557 - INFO - Found tax by amount: 0.0 -> ID 5
2025-11-21 23:16:29,053 - INFO - Found tax by amount: 0.0 -> ID 5
2025-11-21 23:16:29,305 - INFO - Created PO BPO-6800115 with ID 26
2025-11-21 23:16:29,305 - INFO -   ✓ Created PO BPO-6800115 with ID 26
2025-11-21 23:16:29,305 - INFO - [27/126] Processing PO: BPO-6800117 (7 lines)
2025-11-21 23:16:30,729 - INFO - Found tax by amount: 0.0 -> ID 5
2025-11-21 23:16:31,222 - INFO - Found tax by amount: 0.0 -> ID 5
2025-11-21 23:16:31,848 - INFO - Found tax by amount: 0.0 -> ID 5
2025-11-21 23:16:32,355 - INFO - Found tax by amount: 0.0 -> ID 5
2025-11-21 23:16:32,813 - INFO - Found tax by amount: 0.0 -> ID 5
2025-11-21 23:16:33,316 - INFO - Found tax by amount: 0.0 -> ID 5
2025-11-21 23:16:33,872 - INFO - Found tax by amount: 0.0 -> ID 5
2025-11-21 23:16:34,123 - INFO - Created PO BPO-6800117 with ID 27
2025-11-21 23:16:34,123 - INFO -   ✓ Created PO BPO-6800117 with ID 27
2025-11-21 23:16:34,123 - INFO - [28/126] Processing PO: BPO-6800149 (2 lines)
2025-11-21 23:16:35,583 - INFO - Found tax by amount: 0.0 -> ID 5
2025-11-21 23:16:36,082 - INFO - Found tax by amount: 0.0 -> ID 5
2025-11-21 23:16:36,320 - INFO - Created PO BPO-6800149 with ID 28
2025-11-21 23:16:36,321 - INFO -   ✓ Created PO BPO-6800149 with ID 28
2025-11-21 23:16:36,321 - INFO - [29/126] Processing PO: BPO-6800151 (2 lines)
2025-11-21 23:16:37,743 - INFO - Found tax by amount: 0.0 -> ID 5
2025-11-21 23:16:38,374 - INFO - Found tax by amount: 0.0 -> ID 5
2025-11-21 23:16:38,594 - INFO - Created PO BPO-6800151 with ID 29
2025-11-21 23:16:38,594 - INFO -   ✓ Created PO BPO-6800151 with ID 29
2025-11-21 23:16:38,594 - INFO - [30/126] Processing PO: BPO-6800162 (1 lines)
2025-11-21 23:16:40,428 - INFO - Found tax by amount*100: 7.000000000000001 -> ID 3
2025-11-21 23:16:40,914 - INFO - Created PO BPO-6800162 with ID 30
2025-11-21 23:16:40,914 - INFO -   ✓ Created PO BPO-6800162 with ID 30
2025-11-21 23:16:40,915 - INFO - [31/126] Processing PO: BPO-6800184 (8 lines)
2025-11-21 23:16:43,192 - INFO - Found tax by amount: 0.0 -> ID 5
2025-11-21 23:16:43,985 - INFO - Found tax by amount: 0.0 -> ID 5
2025-11-21 23:16:44,697 - INFO - Found tax by amount: 0.0 -> ID 5
2025-11-21 23:16:45,459 - INFO - Found tax by amount: 0.0 -> ID 5
2025-11-21 23:16:46,253 - INFO - Found tax by amount: 0.0 -> ID 5
2025-11-21 23:16:46,989 - INFO - Found tax by amount: 0.0 -> ID 5
2025-11-21 23:16:47,799 - INFO - Found tax by amount: 0.0 -> ID 5
2025-11-21 23:16:48,501 - INFO - Found tax by amount: 0.0 -> ID 5
2025-11-21 23:16:49,055 - INFO - Created PO BPO-6800184 with ID 31
2025-11-21 23:16:49,055 - INFO -   ✓ Created PO BPO-6800184 with ID 31
2025-11-21 23:16:49,056 - INFO - [32/126] Processing PO: BPO-6800213 (2 lines)
2025-11-21 23:16:51,251 - INFO - Found tax by amount: 0.0 -> ID 5
2025-11-21 23:16:52,026 - INFO - Found tax by amount: 0.0 -> ID 5
2025-11-21 23:16:52,686 - INFO - Created PO BPO-6800213 with ID 32
2025-11-21 23:16:52,686 - INFO -   ✓ Created PO BPO-6800213 with ID 32
2025-11-21 23:16:52,687 - INFO - [33/126] Processing PO: BPO-6800220 (4 lines)
2025-11-21 23:16:54,689 - INFO - Found tax by amount: 0.0 -> ID 5
2025-11-21 23:16:55,481 - INFO - Found tax by amount: 0.0 -> ID 5
2025-11-21 23:16:56,257 - INFO - Found tax by amount: 0.0 -> ID 5
2025-11-21 23:16:56,915 - INFO - Found tax by amount: 0.0 -> ID 5
2025-11-21 23:16:57,154 - INFO - Created PO BPO-6800220 with ID 33
2025-11-21 23:16:57,155 - INFO -   ✓ Created PO BPO-6800220 with ID 33
2025-11-21 23:16:57,155 - INFO - [34/126] Processing PO: BPO-6800247 (5 lines)
2025-11-21 23:16:59,254 - INFO - Found tax by amount: 0.0 -> ID 5
2025-11-21 23:16:59,955 - INFO - Found tax by amount: 0.0 -> ID 5
2025-11-21 23:17:00,714 - INFO - Found tax by amount: 0.0 -> ID 5
2025-11-21 23:17:01,286 - INFO - Found tax by amount: 0.0 -> ID 5
2025-11-21 23:17:01,771 - INFO - Found tax by amount: 0.0 -> ID 5
2025-11-21 23:17:02,037 - INFO - Created PO BPO-6800247 with ID 34
2025-11-21 23:17:02,037 - INFO -   ✓ Created PO BPO-6800247 with ID 34
2025-11-21 23:17:02,038 - INFO - [35/126] Processing PO: BPO-6800248 (3 lines)
2025-11-21 23:17:04,065 - INFO - Found tax by amount: 0.0 -> ID 5
2025-11-21 23:17:04,593 - INFO - Found tax by amount: 0.0 -> ID 5
2025-11-21 23:17:05,077 - INFO - Found tax by amount: 0.0 -> ID 5
2025-11-21 23:17:05,344 - INFO - Created PO BPO-6800248 with ID 35
2025-11-21 23:17:05,345 - INFO -   ✓ Created PO BPO-6800248 with ID 35
2025-11-21 23:17:05,345 - INFO - [36/126] Processing PO: BPO-6800283 (3 lines)
2025-11-21 23:17:07,020 - INFO - Found tax by amount: 0.0 -> ID 5
2025-11-21 23:17:07,852 - INFO - Found tax by amount: 0.0 -> ID 5
2025-11-21 23:17:08,607 - INFO - Found tax by amount: 0.0 -> ID 5
2025-11-21 23:17:09,228 - INFO - Created PO BPO-6800283 with ID 36
2025-11-21 23:17:09,228 - INFO -   ✓ Created PO BPO-6800283 with ID 36
2025-11-21 23:17:09,229 - INFO - [37/126] Processing PO: BPO-6800323 (2 lines)
2025-11-21 23:17:11,390 - INFO - Found tax by amount: 0.0 -> ID 5
2025-11-21 23:17:11,926 - INFO - Found tax by amount: 0.0 -> ID 5
2025-11-21 23:17:12,553 - INFO - Created PO BPO-6800323 with ID 37
2025-11-21 23:17:12,553 - INFO -   ✓ Created PO BPO-6800323 with ID 37
2025-11-21 23:17:12,554 - INFO - [38/126] Processing PO: BPO-6800324 (1 lines)
2025-11-21 23:17:14,113 - INFO - Found tax by amount: 0.0 -> ID 5
2025-11-21 23:17:14,329 - INFO - Created PO BPO-6800324 with ID 38
2025-11-21 23:17:14,329 - INFO -   ✓ Created PO BPO-6800324 with ID 38
2025-11-21 23:17:14,330 - INFO - [39/126] Processing PO: BPO-6800326 (1 lines)
2025-11-21 23:17:15,724 - INFO - Found tax by amount: 0.0 -> ID 5
2025-11-21 23:17:15,941 - INFO - Created PO BPO-6800326 with ID 39
2025-11-21 23:17:15,941 - INFO -   ✓ Created PO BPO-6800326 with ID 39
2025-11-21 23:17:15,942 - INFO - [40/126] Processing PO: BPO-6800334 (1 lines)
2025-11-21 23:17:17,269 - INFO - Found tax by amount: 0.0 -> ID 5
2025-11-21 23:17:17,469 - INFO - Created PO BPO-6800334 with ID 40
2025-11-21 23:17:17,470 - INFO -   ✓ Created PO BPO-6800334 with ID 40
2025-11-21 23:17:17,470 - INFO - [41/126] Processing PO: BPO-6800354 (4 lines)
2025-11-21 23:17:18,992 - INFO - Found tax by amount*100: 7.000000000000001 -> ID 3
2025-11-21 23:17:19,667 - INFO - Found tax by amount*100: 7.000000000000001 -> ID 3
2025-11-21 23:17:20,366 - INFO - Found tax by amount*100: 7.000000000000001 -> ID 3
2025-11-21 23:17:20,994 - INFO - Found tax by amount*100: 7.000000000000001 -> ID 3
2025-11-21 23:17:21,229 - INFO - Created PO BPO-6800354 with ID 41
2025-11-21 23:17:21,230 - INFO -   ✓ Created PO BPO-6800354 with ID 41
2025-11-21 23:17:21,230 - INFO - [42/126] Processing PO: BPO-6800357 (9 lines)
2025-11-21 23:17:23,283 - INFO - Found tax by amount*100: 7.000000000000001 -> ID 3
2025-11-21 23:17:24,129 - INFO - Found tax by amount*100: 7.000000000000001 -> ID 3
2025-11-21 23:17:24,884 - INFO - Found tax by amount*100: 7.000000000000001 -> ID 3
2025-11-21 23:17:25,628 - INFO - Found tax by amount*100: 7.000000000000001 -> ID 3
2025-11-21 23:17:26,620 - INFO - Found tax by amount*100: 7.000000000000001 -> ID 3
2025-11-21 23:17:27,533 - INFO - Found tax by amount*100: 7.000000000000001 -> ID 3
2025-11-21 23:17:28,424 - INFO - Found tax by amount*100: 7.000000000000001 -> ID 3
2025-11-21 23:17:29,154 - INFO - Found tax by amount*100: 7.000000000000001 -> ID 3
2025-11-21 23:17:29,813 - INFO - Found tax by amount*100: 7.000000000000001 -> ID 3
2025-11-21 23:17:30,578 - INFO - Created PO BPO-6800357 with ID 42
2025-11-21 23:17:30,578 - INFO -   ✓ Created PO BPO-6800357 with ID 42
2025-11-21 23:17:30,579 - INFO - [43/126] Processing PO: BPO-6800365 (1 lines)
2025-11-21 23:17:32,410 - INFO - Found tax by amount*100: 7.000000000000001 -> ID 3
2025-11-21 23:17:33,133 - INFO - Created PO BPO-6800365 with ID 43
2025-11-21 23:17:33,134 - INFO -   ✓ Created PO BPO-6800365 with ID 43
2025-11-21 23:17:33,134 - INFO - [44/126] Processing PO: PD-6500139 (1 lines)
2025-11-21 23:17:35,326 - INFO - Found tax by amount*100: 7.000000000000001 -> ID 3
2025-11-21 23:17:35,802 - INFO - Created PO PD-6500139 with ID 44
2025-11-21 23:17:35,803 - INFO -   ✓ Created PO PD-6500139 with ID 44
2025-11-21 23:17:35,804 - INFO - [45/126] Processing PO: PD-6700030 (2 lines)
2025-11-21 23:17:38,028 - INFO - Found tax by amount*100: 7.000000000000001 -> ID 3
2025-11-21 23:17:38,789 - INFO - Found tax by amount*100: 7.000000000000001 -> ID 3
2025-11-21 23:17:38,997 - INFO - Created PO PD-6700030 with ID 45
2025-11-21 23:17:38,997 - INFO -   ✓ Created PO PD-6700030 with ID 45
2025-11-21 23:17:38,998 - INFO - [46/126] Processing PO: PD-6800082 (2 lines)
2025-11-21 23:17:39,692 - INFO - Using picking_type_id: คลังสินค้าสำเร็จรูป 1: Receipts (ID: 1)
2025-11-21 23:17:40,302 - INFO - Found tax by amount*100: 7.000000000000001 -> ID 3
2025-11-21 23:17:40,869 - INFO - Found tax by amount*100: 7.000000000000001 -> ID 3
2025-11-21 23:17:41,086 - INFO - Created PO PD-6800082 with ID 46
2025-11-21 23:17:41,086 - INFO -   ✓ Created PO PD-6800082 with ID 46
2025-11-21 23:17:41,087 - INFO - [47/126] Processing PO: PD-6800227 (1 lines)
2025-11-21 23:17:41,818 - INFO - Using picking_type_id: คลังวัตถุดิบ 1: Receipts (ID: 121)
2025-11-21 23:17:42,393 - INFO - Found tax by amount*100: 7.000000000000001 -> ID 3
2025-11-21 23:17:42,604 - INFO - Created PO PD-6800227 with ID 47
2025-11-21 23:17:42,604 - INFO -   ✓ Created PO PD-6800227 with ID 47
2025-11-21 23:17:42,604 - INFO - [48/126] Processing PO: PD-6800254 (1 lines)
2025-11-21 23:17:43,309 - INFO - Using picking_type_id: คลังวัตถุดิบ 1: Receipts (ID: 121)
2025-11-21 23:17:43,922 - INFO - Found tax by amount*100: 7.000000000000001 -> ID 3
2025-11-21 23:17:44,121 - INFO - Created PO PD-6800254 with ID 48
2025-11-21 23:17:44,121 - INFO -   ✓ Created PO PD-6800254 with ID 48
2025-11-21 23:17:44,121 - INFO - [49/126] Processing PO: PD-6800405 (1 lines)
2025-11-21 23:17:45,154 - INFO - Using picking_type_id: คลังสินค้าสำเร็จรูป 1: Receipts (ID: 1)
2025-11-21 23:17:46,044 - INFO - Found tax by amount*100: 7.000000000000001 -> ID 3
2025-11-21 23:17:46,755 - INFO - Created PO PD-6800405 with ID 49
2025-11-21 23:17:46,756 - INFO -   ✓ Created PO PD-6800405 with ID 49
2025-11-21 23:17:46,756 - INFO - [50/126] Processing PO: PD-6800444 (1 lines)
2025-11-21 23:17:47,914 - INFO - Using picking_type_id: คลังวัตถุดิบ 1: Receipts (ID: 121)
2025-11-21 23:17:48,799 - INFO - Found tax by amount*100: 7.000000000000001 -> ID 3
2025-11-21 23:17:49,242 - INFO - Created PO PD-6800444 with ID 50
2025-11-21 23:17:49,243 - INFO -   ✓ Created PO PD-6800444 with ID 50
2025-11-21 23:17:49,243 - INFO - [51/126] Processing PO: PD-6800476 (1 lines)
2025-11-21 23:17:50,034 - INFO - Using picking_type_id: คลังวัตถุดิบ 1: Receipts (ID: 121)
2025-11-21 23:17:50,660 - INFO - Found tax by amount*100: 7.000000000000001 -> ID 3
2025-11-21 23:17:51,116 - INFO - Created PO PD-6800476 with ID 51
2025-11-21 23:17:51,117 - INFO -   ✓ Created PO PD-6800476 with ID 51
2025-11-21 23:17:51,117 - INFO - [52/126] Processing PO: PD-6800516 (1 lines)
2025-11-21 23:17:52,954 - INFO - Found tax by amount*100: 7.000000000000001 -> ID 3
2025-11-21 23:17:53,160 - INFO - Created PO PD-6800516 with ID 52
2025-11-21 23:17:53,161 - INFO -   ✓ Created PO PD-6800516 with ID 52
2025-11-21 23:17:53,161 - INFO - [53/126] Processing PO: PD-6800532 (2 lines)
2025-11-21 23:17:54,062 - INFO - Using picking_type_id: คลังวัตถุดิบ 1: Receipts (ID: 121)
2025-11-21 23:17:54,806 - INFO - Found tax by amount*100: 7.000000000000001 -> ID 3
2025-11-21 23:17:55,499 - INFO - Found tax by amount*100: 7.000000000000001 -> ID 3
2025-11-21 23:17:55,723 - INFO - Created PO PD-6800532 with ID 53
2025-11-21 23:17:55,724 - INFO -   ✓ Created PO PD-6800532 with ID 53
2025-11-21 23:17:55,724 - INFO - [54/126] Processing PO: PD-6800533 (2 lines)
2025-11-21 23:17:56,444 - INFO - Using picking_type_id: คลังสินค้าสำเร็จรูป 1: Receipts (ID: 1)
2025-11-21 23:17:57,163 - INFO - Found tax by amount*100: 7.000000000000001 -> ID 3
2025-11-21 23:17:57,795 - INFO - Found tax by amount*100: 7.000000000000001 -> ID 3
2025-11-21 23:17:58,025 - INFO - Created PO PD-6800533 with ID 54
2025-11-21 23:17:58,026 - INFO -   ✓ Created PO PD-6800533 with ID 54
2025-11-21 23:17:58,026 - INFO - [55/126] Processing PO: PD-6800553 (3 lines)
2025-11-21 23:17:58,697 - INFO - Using picking_type_id: คลังสิ้นเปลืองโรงงาน: Receipts (ID: 181)
2025-11-21 23:17:59,091 - INFO - Found tax by amount: 0.0 -> ID 5
2025-11-21 23:17:59,467 - INFO - Found tax by amount: 0.0 -> ID 5
2025-11-21 23:17:59,797 - INFO - Found tax by amount: 0.0 -> ID 5
2025-11-21 23:18:00,020 - INFO - Created PO PD-6800553 with ID 55
2025-11-21 23:18:00,020 - INFO -   ✓ Created PO PD-6800553 with ID 55
2025-11-21 23:18:00,021 - INFO - [56/126] Processing PO: PD-6800556 (2 lines)
2025-11-21 23:18:01,926 - INFO - Found tax by amount*100: 7.000000000000001 -> ID 3
2025-11-21 23:18:02,773 - INFO - Found tax by amount*100: 7.000000000000001 -> ID 3
2025-11-21 23:18:03,213 - INFO - Created PO PD-6800556 with ID 56
2025-11-21 23:18:03,213 - INFO -   ✓ Created PO PD-6800556 with ID 56
2025-11-21 23:18:03,214 - INFO - [57/126] Processing PO: PD-6800572 (3 lines)
2025-11-21 23:18:04,884 - INFO - Found tax by amount*100: 7.000000000000001 -> ID 3
2025-11-21 23:18:05,497 - INFO - Found tax by amount*100: 7.000000000000001 -> ID 3
2025-11-21 23:18:06,109 - INFO - Found tax by amount*100: 7.000000000000001 -> ID 3
2025-11-21 23:18:06,341 - INFO - Created PO PD-6800572 with ID 57
2025-11-21 23:18:06,341 - INFO -   ✓ Created PO PD-6800572 with ID 57
2025-11-21 23:18:06,342 - INFO - [58/126] Processing PO: PD-6800580 (2 lines)
2025-11-21 23:18:07,011 - INFO - Using picking_type_id: คลังวัตถุดิบ 1: Receipts (ID: 121)
2025-11-21 23:18:07,619 - INFO - Found tax by amount*100: 7.000000000000001 -> ID 3
2025-11-21 23:18:08,244 - INFO - Found tax by amount*100: 7.000000000000001 -> ID 3
2025-11-21 23:18:08,440 - INFO - Created PO PD-6800580 with ID 58
2025-11-21 23:18:08,441 - INFO -   ✓ Created PO PD-6800580 with ID 58
2025-11-21 23:18:08,441 - INFO - [59/126] Processing PO: PD-6800592 (1 lines)
2025-11-21 23:18:09,149 - INFO - Using picking_type_id: คลังวัตถุดิบ 1: Receipts (ID: 121)
2025-11-21 23:18:09,824 - INFO - Found tax by amount*100: 7.000000000000001 -> ID 3
2025-11-21 23:18:10,240 - INFO - Created PO PD-6800592 with ID 59
2025-11-21 23:18:10,241 - INFO -   ✓ Created PO PD-6800592 with ID 59
2025-11-21 23:18:10,241 - INFO - [60/126] Processing PO: PD-6800595 (2 lines)
2025-11-21 23:18:11,273 - INFO - Using picking_type_id: คลังวัตถุดิบ 1: Receipts (ID: 121)
2025-11-21 23:18:12,072 - INFO - Found tax by amount*100: 7.000000000000001 -> ID 3
2025-11-21 23:18:12,686 - INFO - Found tax by amount*100: 7.000000000000001 -> ID 3
2025-11-21 23:18:12,884 - INFO - Created PO PD-6800595 with ID 60
2025-11-21 23:18:12,884 - INFO -   ✓ Created PO PD-6800595 with ID 60
2025-11-21 23:18:12,884 - INFO - [61/126] Processing PO: PD-6800598 (2 lines)
2025-11-21 23:18:14,673 - INFO - Found tax by amount*100: 7.000000000000001 -> ID 3
2025-11-21 23:18:15,608 - INFO - Found tax by amount*100: 7.000000000000001 -> ID 3
2025-11-21 23:18:16,144 - INFO - Created PO PD-6800598 with ID 61
2025-11-21 23:18:16,144 - INFO -   ✓ Created PO PD-6800598 with ID 61
2025-11-21 23:18:16,145 - INFO - [62/126] Processing PO: PD-6800616 (1 lines)
2025-11-21 23:18:18,111 - INFO - Found tax by amount*100: 7.000000000000001 -> ID 3
2025-11-21 23:18:18,703 - INFO - Created PO PD-6800616 with ID 62
2025-11-21 23:18:18,703 - INFO -   ✓ Created PO PD-6800616 with ID 62
2025-11-21 23:18:18,703 - INFO - [63/126] Processing PO: PD-6800618 (1 lines)
2025-11-21 23:18:19,444 - INFO - Using picking_type_id: คลังสิ้นเปลืองโรงงาน: Receipts (ID: 181)
2025-11-21 23:18:20,065 - INFO - Found tax by amount*100: 7.000000000000001 -> ID 3
2025-11-21 23:18:20,257 - INFO - Created PO PD-6800618 with ID 63
2025-11-21 23:18:20,258 - INFO -   ✓ Created PO PD-6800618 with ID 63
2025-11-21 23:18:20,258 - INFO - [64/126] Processing PO: PD-6800622 (1 lines)
2025-11-21 23:18:20,939 - INFO - Using picking_type_id: คลังวัตถุดิบ 1: Receipts (ID: 121)
2025-11-21 23:18:21,603 - INFO - Found tax by amount*100: 7.000000000000001 -> ID 3
2025-11-21 23:18:21,790 - INFO - Created PO PD-6800622 with ID 64
2025-11-21 23:18:21,790 - INFO -   ✓ Created PO PD-6800622 with ID 64
2025-11-21 23:18:21,791 - INFO - [65/126] Processing PO: PD-6800623 (1 lines)
2025-11-21 23:18:22,568 - INFO - Using picking_type_id: คลังวัตถุดิบ 1: Receipts (ID: 121)
2025-11-21 23:18:23,217 - INFO - Found tax by amount*100: 7.000000000000001 -> ID 3
2025-11-21 23:18:23,573 - INFO - Created PO PD-6800623 with ID 65
2025-11-21 23:18:23,573 - INFO -   ✓ Created PO PD-6800623 with ID 65
2025-11-21 23:18:23,574 - INFO - [66/126] Processing PO: PD-6800625 (1 lines)
2025-11-21 23:18:24,368 - INFO - Using picking_type_id: คลังวัตถุดิบ 1: Receipts (ID: 121)
2025-11-21 23:18:25,205 - INFO - Found tax by amount*100: 7.000000000000001 -> ID 3
2025-11-21 23:18:25,767 - INFO - Created PO PD-6800625 with ID 66
2025-11-21 23:18:25,768 - INFO -   ✓ Created PO PD-6800625 with ID 66
2025-11-21 23:18:25,768 - INFO - [67/126] Processing PO: PD-6800631 (2 lines)
2025-11-21 23:18:28,111 - INFO - Found tax by amount*100: 7.000000000000001 -> ID 3
2025-11-21 23:18:29,010 - INFO - Found tax by amount*100: 7.000000000000001 -> ID 3
2025-11-21 23:18:29,660 - INFO - Created PO PD-6800631 with ID 67
2025-11-21 23:18:29,662 - INFO -   ✓ Created PO PD-6800631 with ID 67
2025-11-21 23:18:29,662 - INFO - [68/126] Processing PO: PD-6800633 (1 lines)
2025-11-21 23:18:30,640 - INFO - Using picking_type_id: คลังวัตถุดิบ 1: Receipts (ID: 121)
2025-11-21 23:18:31,540 - INFO - Found tax by amount*100: 7.000000000000001 -> ID 3
2025-11-21 23:18:32,242 - INFO - Created PO PD-6800633 with ID 68
2025-11-21 23:18:32,243 - INFO -   ✓ Created PO PD-6800633 with ID 68
2025-11-21 23:18:32,243 - INFO - [69/126] Processing PO: PD-6800634 (1 lines)
2025-11-21 23:18:34,486 - INFO - Found tax by amount*100: 7.000000000000001 -> ID 3
2025-11-21 23:18:34,983 - INFO - Created PO PD-6800634 with ID 69
2025-11-21 23:18:34,984 - INFO -   ✓ Created PO PD-6800634 with ID 69
2025-11-21 23:18:34,984 - INFO - [70/126] Processing PO: PD-6800635 (6 lines)
2025-11-21 23:18:36,025 - INFO - Using picking_type_id: คลังวัตถุดิบ 1: Receipts (ID: 121)
2025-11-21 23:18:37,197 - INFO - Found tax by amount*100: 7.000000000000001 -> ID 3
2025-11-21 23:18:37,966 - INFO - Found tax by amount*100: 7.000000000000001 -> ID 3
2025-11-21 23:18:38,559 - INFO - Found tax by amount*100: 7.000000000000001 -> ID 3
2025-11-21 23:18:39,192 - INFO - Found tax by amount*100: 7.000000000000001 -> ID 3
2025-11-21 23:18:39,811 - INFO - Found tax by amount*100: 7.000000000000001 -> ID 3
2025-11-21 23:18:40,643 - INFO - Found tax by amount*100: 7.000000000000001 -> ID 3
2025-11-21 23:18:40,936 - INFO - Created PO PD-6800635 with ID 70
2025-11-21 23:18:40,937 - INFO -   ✓ Created PO PD-6800635 with ID 70
2025-11-21 23:18:40,937 - INFO - [71/126] Processing PO: PD-6800636 (6 lines)
2025-11-21 23:18:41,617 - INFO - Using picking_type_id: คลังวัตถุดิบ 1: Receipts (ID: 121)
2025-11-21 23:18:42,235 - INFO - Found tax by amount*100: 7.000000000000001 -> ID 3
2025-11-21 23:18:43,123 - INFO - Found tax by amount*100: 7.000000000000001 -> ID 3
2025-11-21 23:18:43,729 - INFO - Found tax by amount*100: 7.000000000000001 -> ID 3
2025-11-21 23:18:44,383 - INFO - Found tax by amount*100: 7.000000000000001 -> ID 3
2025-11-21 23:18:45,072 - INFO - Found tax by amount*100: 7.000000000000001 -> ID 3
2025-11-21 23:18:45,704 - INFO - Found tax by amount*100: 7.000000000000001 -> ID 3
2025-11-21 23:18:46,276 - INFO - Created PO PD-6800636 with ID 71
2025-11-21 23:18:46,277 - INFO -   ✓ Created PO PD-6800636 with ID 71
2025-11-21 23:18:46,277 - INFO - [72/126] Processing PO: PD-6800637 (3 lines)
2025-11-21 23:18:47,179 - INFO - Using picking_type_id: คลังสินค้าสำเร็จรูป 1: Receipts (ID: 1)
2025-11-21 23:18:47,780 - INFO - Found tax by amount*100: 7.000000000000001 -> ID 3
2025-11-21 23:18:48,345 - INFO - Found tax by amount*100: 7.000000000000001 -> ID 3
2025-11-21 23:18:49,048 - INFO - Found tax by amount*100: 7.000000000000001 -> ID 3
2025-11-21 23:18:49,246 - INFO - Created PO PD-6800637 with ID 72
2025-11-21 23:18:49,247 - INFO -   ✓ Created PO PD-6800637 with ID 72
2025-11-21 23:18:49,247 - INFO - [73/126] Processing PO: PD-6800642 (2 lines)
2025-11-21 23:18:49,971 - INFO - Using picking_type_id: คลังสิ้นเปลืองโรงงาน: Receipts (ID: 181)
2025-11-21 23:18:50,572 - INFO - Found tax by amount*100: 7.000000000000001 -> ID 3
2025-11-21 23:18:51,558 - INFO - Found tax by amount*100: 7.000000000000001 -> ID 3
2025-11-21 23:18:52,093 - INFO - Created PO PD-6800642 with ID 73
2025-11-21 23:18:52,094 - INFO -   ✓ Created PO PD-6800642 with ID 73
2025-11-21 23:18:52,094 - INFO - [74/126] Processing PO: PD-6800643 (1 lines)
2025-11-21 23:18:52,933 - INFO - Using picking_type_id: คลังสิ้นเปลืองโรงงาน: Receipts (ID: 181)
2025-11-21 23:18:53,320 - INFO - Found tax by amount: 0.0 -> ID 5
2025-11-21 23:18:53,931 - INFO - Created PO PD-6800643 with ID 74
2025-11-21 23:18:53,932 - INFO -   ✓ Created PO PD-6800643 with ID 74
2025-11-21 23:18:53,933 - INFO - [75/126] Processing PO: PD-6800644 (1 lines)
2025-11-21 23:18:54,859 - INFO - Using picking_type_id: คลังสิ้นเปลืองโรงงาน: Receipts (ID: 181)
2025-11-21 23:18:55,438 - INFO - Found tax by amount*100: 7.000000000000001 -> ID 3
2025-11-21 23:18:55,634 - INFO - Created PO PD-6800644 with ID 75
2025-11-21 23:18:55,635 - INFO -   ✓ Created PO PD-6800644 with ID 75
2025-11-21 23:18:55,635 - INFO - [76/126] Processing PO: PD-6800645 (1 lines)
2025-11-21 23:18:56,408 - INFO - Using picking_type_id: คลังสิ้นเปลืองโรงงาน: Receipts (ID: 181)
2025-11-21 23:18:57,532 - INFO - Found tax by amount*100: 7.000000000000001 -> ID 3
2025-11-21 23:18:57,841 - INFO - Created PO PD-6800645 with ID 76
2025-11-21 23:18:57,841 - INFO -   ✓ Created PO PD-6800645 with ID 76
2025-11-21 23:18:57,842 - INFO - [77/126] Processing PO: PD-6800646 (1 lines)
2025-11-21 23:18:58,524 - INFO - Using picking_type_id: คลังสิ้นเปลืองโรงงาน: Receipts (ID: 181)
2025-11-21 23:18:59,154 - INFO - Found tax by amount*100: 7.000000000000001 -> ID 3
2025-11-21 23:18:59,741 - INFO - Created PO PD-6800646 with ID 77
2025-11-21 23:18:59,741 - INFO -   ✓ Created PO PD-6800646 with ID 77
2025-11-21 23:18:59,742 - INFO - [78/126] Processing PO: PD-6800647 (1 lines)
2025-11-21 23:19:01,086 - INFO - Using picking_type_id: คลังสิ้นเปลืองโรงงาน: Receipts (ID: 181)
2025-11-21 23:19:01,479 - INFO - Found tax by amount: 0.0 -> ID 5
2025-11-21 23:19:01,703 - INFO - Created PO PD-6800647 with ID 78
2025-11-21 23:19:01,703 - INFO -   ✓ Created PO PD-6800647 with ID 78
2025-11-21 23:19:01,704 - INFO - [79/126] Processing PO: PD-6800648 (1 lines)
2025-11-21 23:19:02,781 - INFO - Using picking_type_id: คลังสิ้นเปลืองโรงงาน: Receipts (ID: 181)
2025-11-21 23:19:03,596 - INFO - Found tax by amount*100: 7.000000000000001 -> ID 3
2025-11-21 23:19:03,797 - INFO - Created PO PD-6800648 with ID 79
2025-11-21 23:19:03,797 - INFO -   ✓ Created PO PD-6800648 with ID 79
2025-11-21 23:19:03,797 - INFO - [80/126] Processing PO: PD-6800649 (3 lines)
2025-11-21 23:19:04,479 - INFO - Using picking_type_id: คลังสินค้าสำเร็จรูป 1: Receipts (ID: 1)
2025-11-21 23:19:05,088 - INFO - Found tax by amount*100: 7.000000000000001 -> ID 3
2025-11-21 23:19:05,664 - INFO - Found tax by amount*100: 7.000000000000001 -> ID 3
2025-11-21 23:19:06,385 - INFO - Found tax by amount*100: 7.000000000000001 -> ID 3
2025-11-21 23:19:06,834 - INFO - Created PO PD-6800649 with ID 80
2025-11-21 23:19:06,835 - INFO -   ✓ Created PO PD-6800649 with ID 80
2025-11-21 23:19:06,835 - INFO - [81/126] Processing PO: PD-6800650 (2 lines)
2025-11-21 23:19:07,515 - INFO - Using picking_type_id: คลังสิ้นเปลืองโรงงาน: Receipts (ID: 181)
2025-11-21 23:19:08,280 - INFO - Found tax by amount*100: 7.000000000000001 -> ID 3
2025-11-21 23:19:09,983 - INFO - Found tax by amount*100: 7.000000000000001 -> ID 3
2025-11-21 23:19:10,367 - INFO - Created PO PD-6800650 with ID 81
2025-11-21 23:19:10,368 - INFO -   ✓ Created PO PD-6800650 with ID 81
2025-11-21 23:19:10,368 - INFO - [82/126] Processing PO: PO-6400285 (1 lines)
2025-11-21 23:19:12,341 - INFO - Using picking_type_id: คลังสินค้าสำเร็จรูป 1: Receipts (ID: 1)
2025-11-21 23:19:12,973 - INFO - Found tax by amount*100: 7.000000000000001 -> ID 3
2025-11-21 23:19:13,183 - INFO - Created PO PO-6400285 with ID 82
2025-11-21 23:19:13,184 - INFO -   ✓ Created PO PO-6400285 with ID 82
2025-11-21 23:19:13,184 - INFO - [83/126] Processing PO: PO-6500103 (1 lines)
2025-11-21 23:19:13,940 - INFO - Using picking_type_id: คลังสินค้าสำเร็จรูป 1: Receipts (ID: 1)
2025-11-21 23:19:14,592 - INFO - Found tax by amount*100: 7.000000000000001 -> ID 3
2025-11-21 23:19:14,814 - INFO - Created PO PO-6500103 with ID 83
2025-11-21 23:19:14,814 - INFO -   ✓ Created PO PO-6500103 with ID 83
2025-11-21 23:19:14,815 - INFO - [84/126] Processing PO: PO-6500219 (1 lines)
2025-11-21 23:19:15,448 - INFO - Using picking_type_id: คลังสินค้าสำเร็จรูป 1: Receipts (ID: 1)
2025-11-21 23:19:16,022 - INFO - Found tax by amount*100: 7.000000000000001 -> ID 3
2025-11-21 23:19:16,204 - INFO - Created PO PO-6500219 with ID 84
2025-11-21 23:19:16,204 - INFO -   ✓ Created PO PO-6500219 with ID 84
2025-11-21 23:19:16,205 - INFO - [85/126] Processing PO: PO-6500540 (1 lines)
2025-11-21 23:19:16,917 - INFO - Using picking_type_id: คลังสินค้าสำเร็จรูป 1: Receipts (ID: 1)
2025-11-21 23:19:17,512 - INFO - Found tax by amount*100: 7.000000000000001 -> ID 3
2025-11-21 23:19:17,716 - INFO - Created PO PO-6500540 with ID 85
2025-11-21 23:19:17,717 - INFO -   ✓ Created PO PO-6500540 with ID 85
2025-11-21 23:19:17,717 - INFO - [86/126] Processing PO: PO-6600222 (4 lines)
2025-11-21 23:19:18,520 - INFO - Using picking_type_id: คลังสินค้าสำเร็จรูป 1: Receipts (ID: 1)
2025-11-21 23:19:19,129 - INFO - Found tax by amount*100: 7.000000000000001 -> ID 3
2025-11-21 23:19:19,704 - INFO - Found tax by amount*100: 7.000000000000001 -> ID 3
2025-11-21 23:19:20,468 - INFO - Found tax by amount*100: 7.000000000000001 -> ID 3
2025-11-21 23:19:21,082 - INFO - Found tax by amount*100: 7.000000000000001 -> ID 3
2025-11-21 23:19:21,312 - INFO - Created PO PO-6600222 with ID 86
2025-11-21 23:19:21,313 - INFO -   ✓ Created PO PO-6600222 with ID 86
2025-11-21 23:19:21,313 - INFO - [87/126] Processing PO: PO-6600351 (2 lines)
2025-11-21 23:19:22,100 - INFO - Using picking_type_id: คลังสินค้าสำเร็จรูป 1: Receipts (ID: 1)
2025-11-21 23:19:22,769 - INFO - Found tax by amount*100: 7.000000000000001 -> ID 3
2025-11-21 23:19:24,102 - INFO - Found tax by amount*100: 7.000000000000001 -> ID 3
2025-11-21 23:19:24,310 - INFO - Created PO PO-6600351 with ID 87
2025-11-21 23:19:24,310 - INFO -   ✓ Created PO PO-6600351 with ID 87
2025-11-21 23:19:24,310 - INFO - [88/126] Processing PO: PO-6600361 (3 lines)
2025-11-21 23:19:25,568 - INFO - Using picking_type_id: คลังสินค้าสำเร็จรูป 1: Receipts (ID: 1)
2025-11-21 23:19:26,262 - INFO - Found tax by amount*100: 7.000000000000001 -> ID 3
2025-11-21 23:19:27,015 - INFO - Found tax by amount*100: 7.000000000000001 -> ID 3
2025-11-21 23:19:27,653 - INFO - Found tax by amount*100: 7.000000000000001 -> ID 3
2025-11-21 23:19:27,871 - INFO - Created PO PO-6600361 with ID 88
2025-11-21 23:19:27,871 - INFO -   ✓ Created PO PO-6600361 with ID 88
2025-11-21 23:19:27,872 - INFO - [89/126] Processing PO: PO-6700426 (2 lines)
2025-11-21 23:19:28,623 - INFO - Using picking_type_id: คลังสินค้าสำเร็จรูป 1: Receipts (ID: 1)
2025-11-21 23:19:29,235 - INFO - Found tax by amount*100: 7.000000000000001 -> ID 3
2025-11-21 23:19:29,853 - INFO - Found tax by amount*100: 7.000000000000001 -> ID 3
2025-11-21 23:19:30,073 - INFO - Created PO PO-6700426 with ID 89
2025-11-21 23:19:30,074 - INFO -   ✓ Created PO PO-6700426 with ID 89
2025-11-21 23:19:30,074 - INFO - [90/126] Processing PO: PO-6700435 (2 lines)
2025-11-21 23:19:30,746 - INFO - Using picking_type_id: คลังสินค้าสำเร็จรูป 1: Receipts (ID: 1)
2025-11-21 23:19:31,690 - INFO - Found tax by amount*100: 7.000000000000001 -> ID 3
2025-11-21 23:19:32,265 - INFO - Found tax by amount*100: 7.000000000000001 -> ID 3
2025-11-21 23:19:32,515 - INFO - Created PO PO-6700435 with ID 90
2025-11-21 23:19:32,515 - INFO -   ✓ Created PO PO-6700435 with ID 90
2025-11-21 23:19:32,515 - INFO - [91/126] Processing PO: PO-6800005 (3 lines)
2025-11-21 23:19:33,149 - INFO - Using picking_type_id: คลังสินค้าสำเร็จรูป 1: Receipts (ID: 1)
2025-11-21 23:19:33,736 - INFO - Found tax by amount*100: 7.000000000000001 -> ID 3
2025-11-21 23:19:34,318 - INFO - Found tax by amount*100: 7.000000000000001 -> ID 3
2025-11-21 23:19:34,953 - INFO - Found tax by amount*100: 7.000000000000001 -> ID 3
2025-11-21 23:19:35,171 - INFO - Created PO PO-6800005 with ID 91
2025-11-21 23:19:35,172 - INFO -   ✓ Created PO PO-6800005 with ID 91
2025-11-21 23:19:35,172 - INFO - [92/126] Processing PO: PO-6800057 (2 lines)
2025-11-21 23:19:35,834 - INFO - Using picking_type_id: คลังสินค้าสำเร็จรูป 1: Receipts (ID: 1)
2025-11-21 23:19:36,078 - ERROR -   ✗ Product not found for old_product_code: nan, default_code: ASS041
2025-11-21 23:19:36,086 - INFO - [93/126] Processing PO: PO-6800221 (3 lines)
2025-11-21 23:19:36,743 - INFO - Using picking_type_id: คลังทรัพย์สิน: Receipts (ID: 11)
2025-11-21 23:19:37,313 - INFO - Found tax by amount*100: 7.000000000000001 -> ID 3
2025-11-21 23:19:38,040 - INFO - Found tax by amount*100: 7.000000000000001 -> ID 3
2025-11-21 23:19:38,801 - INFO - Found tax by amount*100: 7.000000000000001 -> ID 3
2025-11-21 23:19:39,009 - INFO - Created PO PO-6800221 with ID 92
2025-11-21 23:19:39,009 - INFO -   ✓ Created PO PO-6800221 with ID 92
2025-11-21 23:19:39,009 - INFO - [94/126] Processing PO: PO-6800362 (2 lines)
2025-11-21 23:19:39,746 - INFO - Using picking_type_id: คลังสินค้าสำเร็จรูป 1: Receipts (ID: 1)
2025-11-21 23:19:40,357 - INFO - Found tax by amount*100: 7.000000000000001 -> ID 3
2025-11-21 23:19:41,013 - INFO - Found tax by amount*100: 7.000000000000001 -> ID 3
2025-11-21 23:19:41,202 - INFO - Created PO PO-6800362 with ID 93
2025-11-21 23:19:41,202 - INFO -   ✓ Created PO PO-6800362 with ID 93
2025-11-21 23:19:41,202 - INFO - [95/126] Processing PO: PO-6800363 (3 lines)
2025-11-21 23:19:41,906 - INFO - Using picking_type_id: คลังสินค้าสำเร็จรูป 1: Receipts (ID: 1)
2025-11-21 23:19:42,600 - INFO - Found tax by amount*100: 7.000000000000001 -> ID 3
2025-11-21 23:19:43,399 - INFO - Found tax by amount*100: 7.000000000000001 -> ID 3
2025-11-21 23:19:44,141 - INFO - Found tax by amount*100: 7.000000000000001 -> ID 3
2025-11-21 23:19:44,352 - INFO - Created PO PO-6800363 with ID 94
2025-11-21 23:19:44,353 - INFO -   ✓ Created PO PO-6800363 with ID 94
2025-11-21 23:19:44,353 - INFO - [96/126] Processing PO: PO-6800423 (1 lines)
2025-11-21 23:19:45,270 - INFO - Using picking_type_id: คลังสินค้าสำเร็จรูป 1: Receipts (ID: 1)
2025-11-21 23:19:45,878 - INFO - Found tax by amount*100: 7.000000000000001 -> ID 3
2025-11-21 23:19:46,066 - INFO - Created PO PO-6800423 with ID 95
2025-11-21 23:19:46,067 - INFO -   ✓ Created PO PO-6800423 with ID 95
2025-11-21 23:19:46,067 - INFO - [97/126] Processing PO: PO-6800464 (1 lines)
2025-11-21 23:19:46,775 - INFO - Using picking_type_id: คลังสินค้าสำเร็จรูป 1: Receipts (ID: 1)
2025-11-21 23:19:47,407 - INFO - Found tax by amount*100: 7.000000000000001 -> ID 3
2025-11-21 23:19:47,653 - INFO - Created PO PO-6800464 with ID 96
2025-11-21 23:19:47,654 - INFO -   ✓ Created PO PO-6800464 with ID 96
2025-11-21 23:19:47,654 - INFO - [98/126] Processing PO: PO-6800468 (1 lines)
2025-11-21 23:19:48,460 - INFO - Using picking_type_id: คลังสิ้นเปลืองสำนักงาน: Receipts (ID: 191)
2025-11-21 23:19:48,803 - INFO - Found tax by amount: 0.0 -> ID 5
2025-11-21 23:19:49,027 - INFO - Created PO PO-6800468 with ID 97
2025-11-21 23:19:49,028 - INFO -   ✓ Created PO PO-6800468 with ID 97
2025-11-21 23:19:49,028 - INFO - [99/126] Processing PO: PO-6800472 (1 lines)
2025-11-21 23:19:49,986 - INFO - Using picking_type_id: คลังสินค้าสำเร็จรูป 1: Receipts (ID: 1)
2025-11-21 23:19:50,930 - INFO - Found tax by amount*100: 7.000000000000001 -> ID 3
2025-11-21 23:19:51,580 - INFO - Created PO PO-6800472 with ID 98
2025-11-21 23:19:51,580 - INFO -   ✓ Created PO PO-6800472 with ID 98
2025-11-21 23:19:51,580 - INFO - [100/126] Processing PO: PO-6800473 (9 lines)
2025-11-21 23:19:52,686 - INFO - Using picking_type_id: คลังสินค้าสำเร็จรูป 1: Receipts (ID: 1)
2025-11-21 23:19:53,315 - INFO - Found tax by amount*100: 7.000000000000001 -> ID 3
2025-11-21 23:19:53,874 - INFO - Found tax by amount*100: 7.000000000000001 -> ID 3
2025-11-21 23:19:54,674 - INFO - Found tax by amount*100: 7.000000000000001 -> ID 3
2025-11-21 23:19:55,640 - INFO - Found tax by amount*100: 7.000000000000001 -> ID 3
2025-11-21 23:19:56,595 - INFO - Found tax by amount*100: 7.000000000000001 -> ID 3
2025-11-21 23:19:57,514 - INFO - Found tax by amount*100: 7.000000000000001 -> ID 3
2025-11-21 23:19:58,668 - INFO - Found tax by amount*100: 7.000000000000001 -> ID 3
2025-11-21 23:19:59,766 - INFO - Found tax by amount*100: 7.000000000000001 -> ID 3
2025-11-21 23:20:00,692 - INFO - Found tax by amount*100: 7.000000000000001 -> ID 3
2025-11-21 23:20:01,614 - INFO - Created PO PO-6800473 with ID 99
2025-11-21 23:20:01,614 - INFO -   ✓ Created PO PO-6800473 with ID 99
2025-11-21 23:20:01,614 - INFO - [101/126] Processing PO: PO-6800478 (1 lines)
2025-11-21 23:20:02,741 - INFO - Using picking_type_id: คลังสิ้นเปลืองโรงงาน: Receipts (ID: 181)
2025-11-21 23:20:03,678 - INFO - Found tax by amount*100: 7.000000000000001 -> ID 3
2025-11-21 23:20:04,276 - INFO - Created PO PO-6800478 with ID 100
2025-11-21 23:20:04,277 - INFO -   ✓ Created PO PO-6800478 with ID 100
2025-11-21 23:20:04,277 - INFO - [102/126] Processing PO: PO-6800479 (1 lines)
2025-11-21 23:20:05,441 - INFO - Using picking_type_id: คลังสินค้าสำเร็จรูป 1: Receipts (ID: 1)
2025-11-21 23:20:06,181 - INFO - Found tax by amount*100: 7.000000000000001 -> ID 3
2025-11-21 23:20:06,380 - INFO - Created PO PO-6800479 with ID 101
2025-11-21 23:20:06,381 - INFO -   ✓ Created PO PO-6800479 with ID 101
2025-11-21 23:20:06,381 - INFO - [103/126] Processing PO: PO-6800480 (3 lines)
2025-11-21 23:20:07,174 - INFO - Using picking_type_id: คลังสิ้นเปลืองสำนักงาน: Receipts (ID: 191)
2025-11-21 23:20:07,541 - INFO - Found tax by amount: 0.0 -> ID 5
2025-11-21 23:20:07,884 - INFO - Found tax by amount: 0.0 -> ID 5
2025-11-21 23:20:08,333 - INFO - Found tax by amount: 0.0 -> ID 5
2025-11-21 23:20:08,552 - INFO - Created PO PO-6800480 with ID 102
2025-11-21 23:20:08,552 - INFO -   ✓ Created PO PO-6800480 with ID 102
2025-11-21 23:20:08,553 - INFO - [104/126] Processing PO: PO-6800482 (1 lines)
2025-11-21 23:20:09,532 - INFO - Using picking_type_id: คลังสิ้นเปลืองสำนักงาน: Receipts (ID: 191)
2025-11-21 23:20:10,045 - INFO - Found tax by amount: 0.0 -> ID 5
2025-11-21 23:20:10,542 - INFO - Created PO PO-6800482 with ID 103
2025-11-21 23:20:10,543 - INFO -   ✓ Created PO PO-6800482 with ID 103
2025-11-21 23:20:10,543 - INFO - [105/126] Processing PO: PO-6800483 (3 lines)
2025-11-21 23:20:11,387 - INFO - Using picking_type_id: คลังสินค้าสำเร็จรูป 1: Receipts (ID: 1)
2025-11-21 23:20:11,999 - INFO - Found tax by amount*100: 7.000000000000001 -> ID 3
2025-11-21 23:20:12,561 - INFO - Found tax by amount*100: 7.000000000000001 -> ID 3
2025-11-21 23:20:13,207 - INFO - Found tax by amount*100: 7.000000000000001 -> ID 3
2025-11-21 23:20:13,462 - INFO - Created PO PO-6800483 with ID 104
2025-11-21 23:20:13,462 - INFO -   ✓ Created PO PO-6800483 with ID 104
2025-11-21 23:20:13,463 - INFO - [106/126] Processing PO: PO-6800484 (1 lines)
2025-11-21 23:20:14,212 - INFO - Using picking_type_id: คลังสินค้าสำเร็จรูป 1: Receipts (ID: 1)
2025-11-21 23:20:14,774 - INFO - Found tax by amount*100: 7.000000000000001 -> ID 3
2025-11-21 23:20:14,970 - INFO - Created PO PO-6800484 with ID 105
2025-11-21 23:20:14,970 - INFO -   ✓ Created PO PO-6800484 with ID 105
2025-11-21 23:20:14,971 - INFO - [107/126] Processing PO: PO-6800486 (2 lines)
2025-11-21 23:20:15,762 - INFO - Using picking_type_id: คลังสินค้าสำเร็จรูป 1: Receipts (ID: 1)
2025-11-21 23:20:16,497 - INFO - Found tax by amount*100: 7.000000000000001 -> ID 3
2025-11-21 23:20:17,271 - INFO - Found tax by amount*100: 7.000000000000001 -> ID 3
2025-11-21 23:20:17,486 - INFO - Created PO PO-6800486 with ID 106
2025-11-21 23:20:17,487 - INFO -   ✓ Created PO PO-6800486 with ID 106
2025-11-21 23:20:17,488 - INFO - [108/126] Processing PO: PO-6800487 (3 lines)
2025-11-21 23:20:18,156 - INFO - Using picking_type_id: คลังสินค้าสำเร็จรูป 1: Receipts (ID: 1)
2025-11-21 23:20:18,914 - INFO - Found tax by amount*100: 7.000000000000001 -> ID 3
2025-11-21 23:20:19,472 - INFO - Found tax by amount*100: 7.000000000000001 -> ID 3
2025-11-21 23:20:20,186 - INFO - Found tax by amount*100: 7.000000000000001 -> ID 3
2025-11-21 23:20:20,395 - INFO - Created PO PO-6800487 with ID 107
2025-11-21 23:20:20,395 - INFO -   ✓ Created PO PO-6800487 with ID 107
2025-11-21 23:20:20,395 - INFO - [109/126] Processing PO: PO-6800488 (2 lines)
2025-11-21 23:20:21,161 - INFO - Using picking_type_id: คลังสินค้าสำเร็จรูป 1: Receipts (ID: 1)
2025-11-21 23:20:21,776 - INFO - Found tax by amount*100: 7.000000000000001 -> ID 3
2025-11-21 23:20:22,378 - INFO - Found tax by amount*100: 7.000000000000001 -> ID 3
2025-11-21 23:20:22,576 - INFO - Created PO PO-6800488 with ID 108
2025-11-21 23:20:22,576 - INFO -   ✓ Created PO PO-6800488 with ID 108
2025-11-21 23:20:22,576 - INFO - [110/126] Processing PO: PO-6800489 (3 lines)
2025-11-21 23:20:23,237 - INFO - Using picking_type_id: คลังสินค้าสำเร็จรูป 1: Receipts (ID: 1)
2025-11-21 23:20:24,041 - INFO - Found tax by amount*100: 7.000000000000001 -> ID 3
2025-11-21 23:20:24,658 - INFO - Found tax by amount*100: 7.000000000000001 -> ID 3
2025-11-21 23:20:25,245 - INFO - Found tax by amount*100: 7.000000000000001 -> ID 3
2025-11-21 23:20:25,486 - INFO - Created PO PO-6800489 with ID 109
2025-11-21 23:20:25,487 - INFO -   ✓ Created PO PO-6800489 with ID 109
2025-11-21 23:20:25,487 - INFO - [111/126] Processing PO: PO-6800490 (3 lines)
2025-11-21 23:20:26,212 - INFO - Using picking_type_id: คลังสินค้าสำเร็จรูป 1: Receipts (ID: 1)
2025-11-21 23:20:26,855 - INFO - Found tax by amount*100: 7.000000000000001 -> ID 3
2025-11-21 23:20:27,424 - INFO - Found tax by amount*100: 7.000000000000001 -> ID 3
2025-11-21 23:20:28,331 - INFO - Found tax by amount*100: 7.000000000000001 -> ID 3
2025-11-21 23:20:28,589 - INFO - Created PO PO-6800490 with ID 110
2025-11-21 23:20:28,589 - INFO -   ✓ Created PO PO-6800490 with ID 110
2025-11-21 23:20:28,590 - INFO - [112/126] Processing PO: PO-6800491 (1 lines)
2025-11-21 23:20:29,420 - INFO - Using picking_type_id: คลังสินค้าสำเร็จรูป 1: Receipts (ID: 1)
2025-11-21 23:20:30,042 - INFO - Found tax by amount*100: 7.000000000000001 -> ID 3
2025-11-21 23:20:30,256 - INFO - Created PO PO-6800491 with ID 111
2025-11-21 23:20:30,257 - INFO -   ✓ Created PO PO-6800491 with ID 111
2025-11-21 23:20:30,257 - INFO - [113/126] Processing PO: PO-6800492 (4 lines)
2025-11-21 23:20:31,075 - INFO - Using picking_type_id: คลังสินค้าสำเร็จรูป 1: Receipts (ID: 1)
2025-11-21 23:20:31,571 - INFO - Found tax by amount: 0.0 -> ID 5
2025-11-21 23:20:32,107 - INFO - Found tax by amount: 0.0 -> ID 5
2025-11-21 23:20:32,815 - INFO - Found tax by amount: 0.0 -> ID 5
2025-11-21 23:20:33,483 - INFO - Found tax by amount: 0.0 -> ID 5
2025-11-21 23:20:34,077 - INFO - Created PO PO-6800492 with ID 112
2025-11-21 23:20:34,077 - INFO -   ✓ Created PO PO-6800492 with ID 112
2025-11-21 23:20:34,078 - INFO - [114/126] Processing PO: PO-6800493 (8 lines)
2025-11-21 23:20:34,854 - INFO - Using picking_type_id: คลังสินค้าสำเร็จรูป 1: Receipts (ID: 1)
2025-11-21 23:20:35,442 - INFO - Found tax by amount*100: 7.000000000000001 -> ID 3
2025-11-21 23:20:36,041 - INFO - Found tax by amount*100: 7.000000000000001 -> ID 3
2025-11-21 23:20:36,668 - INFO - Found tax by amount*100: 7.000000000000001 -> ID 3
2025-11-21 23:20:37,388 - INFO - Found tax by amount*100: 7.000000000000001 -> ID 3
2025-11-21 23:20:38,048 - INFO - Found tax by amount*100: 7.000000000000001 -> ID 3
2025-11-21 23:20:38,932 - INFO - Found tax by amount*100: 7.000000000000001 -> ID 3
2025-11-21 23:20:39,779 - INFO - Found tax by amount*100: 7.000000000000001 -> ID 3
2025-11-21 23:20:40,522 - INFO - Found tax by amount*100: 7.000000000000001 -> ID 3
2025-11-21 23:20:40,809 - INFO - Created PO PO-6800493 with ID 113
2025-11-21 23:20:40,809 - INFO -   ✓ Created PO PO-6800493 with ID 113
2025-11-21 23:20:40,809 - INFO - [115/126] Processing PO: PO-6800494 (1 lines)
2025-11-21 23:20:41,714 - INFO - Using picking_type_id: คลังสินค้าสำเร็จรูป 1: Receipts (ID: 1)
2025-11-21 23:20:42,383 - INFO - Found tax by amount*100: 7.000000000000001 -> ID 3
2025-11-21 23:20:42,657 - INFO - Created PO PO-6800494 with ID 114
2025-11-21 23:20:42,657 - INFO -   ✓ Created PO PO-6800494 with ID 114
2025-11-21 23:20:42,658 - INFO - [116/126] Processing PO: PO-6800495 (1 lines)
2025-11-21 23:20:43,392 - INFO - Using picking_type_id: คลังสินค้าสำเร็จรูป 1: Receipts (ID: 1)
2025-11-21 23:20:44,002 - INFO - Found tax by amount*100: 7.000000000000001 -> ID 3
2025-11-21 23:20:44,195 - INFO - Created PO PO-6800495 with ID 115
2025-11-21 23:20:44,195 - INFO -   ✓ Created PO PO-6800495 with ID 115
2025-11-21 23:20:44,195 - INFO - [117/126] Processing PO: PO-6800496 (1 lines)
2025-11-21 23:20:45,152 - INFO - Using picking_type_id: คลังวัตถุดิบ 1: Receipts (ID: 121)
2025-11-21 23:20:45,773 - INFO - Found tax by amount*100: 7.000000000000001 -> ID 3
2025-11-21 23:20:45,984 - INFO - Created PO PO-6800496 with ID 116
2025-11-21 23:20:45,985 - INFO -   ✓ Created PO PO-6800496 with ID 116
2025-11-21 23:20:45,985 - INFO - [118/126] Processing PO: PO-6800497 (1 lines)
2025-11-21 23:20:46,937 - INFO - Using picking_type_id: คลังวัตถุดิบ 1: Receipts (ID: 121)
2025-11-21 23:20:47,781 - INFO - Found tax by amount*100: 7.000000000000001 -> ID 3
2025-11-21 23:20:48,515 - INFO - Created PO PO-6800497 with ID 117
2025-11-21 23:20:48,516 - INFO -   ✓ Created PO PO-6800497 with ID 117
2025-11-21 23:20:48,516 - INFO - [119/126] Processing PO: PO-6800498 (2 lines)
2025-11-21 23:20:49,189 - INFO - Using picking_type_id: คลังวัตถุดิบ 1: Receipts (ID: 121)
2025-11-21 23:20:49,746 - INFO - Found tax by amount*100: 7.000000000000001 -> ID 3
2025-11-21 23:20:50,307 - INFO - Found tax by amount*100: 7.000000000000001 -> ID 3
2025-11-21 23:20:50,500 - INFO - Created PO PO-6800498 with ID 118
2025-11-21 23:20:50,501 - INFO -   ✓ Created PO PO-6800498 with ID 118
2025-11-21 23:20:50,501 - INFO - [120/126] Processing PO: PO-6800499 (2 lines)
2025-11-21 23:20:51,310 - INFO - Using picking_type_id: คลังวัตถุดิบ 1: Receipts (ID: 121)
2025-11-21 23:20:51,953 - INFO - Found tax by amount*100: 7.000000000000001 -> ID 3
2025-11-21 23:20:52,573 - INFO - Found tax by amount*100: 7.000000000000001 -> ID 3
2025-11-21 23:20:52,800 - INFO - Created PO PO-6800499 with ID 119
2025-11-21 23:20:52,800 - INFO -   ✓ Created PO PO-6800499 with ID 119
2025-11-21 23:20:52,801 - INFO - [121/126] Processing PO: PO-6800500 (1 lines)
2025-11-21 23:20:53,485 - INFO - Using picking_type_id: คลังวัตถุดิบ 1: Receipts (ID: 121)
2025-11-21 23:20:54,051 - INFO - Found tax by amount*100: 7.000000000000001 -> ID 3
2025-11-21 23:20:54,281 - INFO - Created PO PO-6800500 with ID 120
2025-11-21 23:20:54,281 - INFO -   ✓ Created PO PO-6800500 with ID 120
2025-11-21 23:20:54,281 - INFO - [122/126] Processing PO: PO-6800501 (2 lines)
2025-11-21 23:20:55,192 - INFO - Using picking_type_id: คลังวัตถุดิบ 1: Receipts (ID: 121)
2025-11-21 23:20:55,882 - INFO - Found tax by amount*100: 7.000000000000001 -> ID 3
2025-11-21 23:20:56,444 - INFO - Found tax by amount*100: 7.000000000000001 -> ID 3
2025-11-21 23:20:56,648 - INFO - Created PO PO-6800501 with ID 121
2025-11-21 23:20:56,648 - INFO -   ✓ Created PO PO-6800501 with ID 121
2025-11-21 23:20:56,648 - INFO - [123/126] Processing PO: PO-6800502 (2 lines)
2025-11-21 23:20:57,600 - INFO - Using picking_type_id: คลังวัตถุดิบ 1: Receipts (ID: 121)
2025-11-21 23:20:58,319 - INFO - Found tax by amount*100: 7.000000000000001 -> ID 3
2025-11-21 23:20:58,931 - INFO - Found tax by amount*100: 7.000000000000001 -> ID 3
2025-11-21 23:20:59,141 - INFO - Created PO PO-6800502 with ID 122
2025-11-21 23:20:59,142 - INFO -   ✓ Created PO PO-6800502 with ID 122
2025-11-21 23:20:59,142 - INFO - [124/126] Processing PO: PO-6800503 (2 lines)
2025-11-21 23:20:59,958 - INFO - Using picking_type_id: คลังวัตถุดิบ 1: Receipts (ID: 121)
2025-11-21 23:21:00,556 - INFO - Found tax by amount*100: 7.000000000000001 -> ID 3
2025-11-21 23:21:01,166 - INFO - Found tax by amount*100: 7.000000000000001 -> ID 3
2025-11-21 23:21:01,397 - INFO - Created PO PO-6800503 with ID 123
2025-11-21 23:21:01,397 - INFO -   ✓ Created PO PO-6800503 with ID 123
2025-11-21 23:21:01,397 - INFO - [125/126] Processing PO: PO-6800504 (2 lines)
2025-11-21 23:21:02,357 - INFO - Using picking_type_id: คลังสินค้าสำเร็จรูป 1: Receipts (ID: 1)
2025-11-21 23:21:03,564 - INFO - Found tax by amount*100: 7.000000000000001 -> ID 3
2025-11-21 23:21:04,168 - INFO - Found tax by amount*100: 7.000000000000001 -> ID 3
2025-11-21 23:21:04,370 - INFO - Created PO PO-6800504 with ID 124
2025-11-21 23:21:04,370 - INFO -   ✓ Created PO PO-6800504 with ID 124
2025-11-21 23:21:04,371 - INFO - [126/126] Processing PO: PO-6800507 (1 lines)
2025-11-21 23:21:05,250 - INFO - Using picking_type_id: คลังสินค้าสำเร็จรูป 1: Receipts (ID: 1)
2025-11-21 23:21:05,965 - INFO - Found tax by amount*100: 7.000000000000001 -> ID 3
2025-11-21 23:21:05,965 - ERROR - Error creating PO PO-6800507: cannot marshal None unless allow_none is enabled
2025-11-21 23:21:05,966 - ERROR -   ✗ Error creating PO PO-6800507: cannot marshal None unless allow_none is enabled
2025-11-21 23:21:05,970 - INFO - --------------------------------------------------------------------------------
2025-11-21 23:21:05,970 - INFO - 
================================================================================
2025-11-21 23:21:05,970 - INFO - IMPORT SUMMARY
2025-11-21 23:21:05,970 - INFO - ================================================================================
2025-11-21 23:21:05,970 - INFO - Total POs processed: 126
2025-11-21 23:21:05,970 - INFO - ✓ Successful:        124
2025-11-21 23:21:05,970 - INFO - ✗ Failed:            2
2025-11-21 23:21:05,970 - INFO - Success rate:        98.4%
2025-11-21 23:21:06,023 - INFO - 
! Error details saved to: Import_PO/logs/po_errors_20251121_231453.xlsx
2025-11-21 23:21:06,023 - INFO - ================================================================================

