2025-12-01 15:11:20,073 - INFO - Successfully connected to Odoo as apichart@mogen.co.th
2025-12-01 15:11:20,075 - INFO - 
================================================================================
2025-12-01 15:11:20,076 - INFO - Starting import from: Import_PO/Template_PO_new.xlsx
2025-12-01 15:11:20,077 - INFO - Dry-run mode: False
2025-12-01 15:11:20,077 - INFO - ================================================================================
2025-12-01 15:11:20,534 - INFO - --------------------------------------------------------------------------------
2025-12-01 15:11:20,536 - INFO - [1/468] Processing PO: BOEP6708018 (1 lines)
2025-12-01 15:11:21,719 - INFO - [2/468] Processing PO: BOEP6708022 (1 lines)
2025-12-01 15:11:22,319 - INFO - [3/468] Processing PO: BOEP6709022 (1 lines)
2025-12-01 15:11:22,948 - INFO - [4/468] Processing PO: BOEP6710014 (1 lines)
2025-12-01 15:11:23,701 - INFO - [5/468] Processing PO: BOEP6711019 (1 lines)
2025-12-01 15:11:23,868 - INFO - [6/468] Processing PO: BOEP6712021 (1 lines)
2025-12-01 15:11:24,037 - INFO - [7/468] Processing PO: BOEP6712024 (1 lines)
2025-12-01 15:11:24,223 - INFO - [8/468] Processing PO: BOEP6801017 (1 lines)
2025-12-01 15:11:24,800 - INFO - Using picking_type_id: คลังสินค้าสำเร็จรูป 1: Receipts (ID: 1)
2025-12-01 15:11:25,228 - INFO - Created PO BOEP6801017 with ID 140
2025-12-01 15:11:25,238 - INFO - [9/468] Processing PO: BOEP6805001 (1 lines)
2025-12-01 15:11:25,859 - INFO - Using picking_type_id: คลังสินค้าสำเร็จรูป 1: Receipts (ID: 1)
2025-12-01 15:11:26,254 - INFO - Created PO BOEP6805001 with ID 141
2025-12-01 15:11:26,264 - INFO - [10/468] Processing PO: BOEP6805002 (1 lines)
2025-12-01 15:11:26,849 - INFO - Using picking_type_id: คลังสินค้าสำเร็จรูป 1: Receipts (ID: 1)
2025-12-01 15:11:27,199 - INFO - Created PO BOEP6805002 with ID 142
2025-12-01 15:11:27,208 - INFO - [11/468] Processing PO: BOEP6805003 (1 lines)
2025-12-01 15:11:27,866 - INFO - Using picking_type_id: คลังสินค้าสำเร็จรูป 1: Receipts (ID: 1)
2025-12-01 15:11:28,190 - INFO - Created PO BOEP6805003 with ID 143
2025-12-01 15:11:28,195 - INFO - [12/468] Processing PO: BOEP6805004 (1 lines)
2025-12-01 15:11:29,317 - INFO - Using picking_type_id: คลังสินค้าสำเร็จรูป 1: Receipts (ID: 1)
2025-12-01 15:11:29,677 - INFO - Created PO BOEP6805004 with ID 144
2025-12-01 15:11:29,687 - INFO - [13/468] Processing PO: BOEP6805005 (1 lines)
2025-12-01 15:11:30,245 - INFO - Using picking_type_id: คลังสินค้าสำเร็จรูป 1: Receipts (ID: 1)
2025-12-01 15:11:30,597 - INFO - Created PO BOEP6805005 with ID 145
2025-12-01 15:11:30,606 - INFO - [14/468] Processing PO: BOEP6805006 (1 lines)
2025-12-01 15:11:31,237 - INFO - Using picking_type_id: คลังสินค้าสำเร็จรูป 1: Receipts (ID: 1)
2025-12-01 15:11:31,612 - INFO - Created PO BOEP6805006 with ID 146
2025-12-01 15:11:31,617 - INFO - [15/468] Processing PO: BOEP6805007 (1 lines)
2025-12-01 15:11:32,178 - INFO - Using picking_type_id: คลังสินค้าสำเร็จรูป 1: Receipts (ID: 1)
2025-12-01 15:11:32,544 - INFO - Created PO BOEP6805007 with ID 147
2025-12-01 15:11:32,548 - INFO - [16/468] Processing PO: BOEP6805008 (1 lines)
2025-12-01 15:11:33,107 - INFO - Using picking_type_id: คลังสินค้าสำเร็จรูป 1: Receipts (ID: 1)
2025-12-01 15:11:33,497 - INFO - Created PO BOEP6805008 with ID 148
2025-12-01 15:11:33,501 - INFO - [17/468] Processing PO: BOEP6805009 (1 lines)
2025-12-01 15:11:34,039 - INFO - Using picking_type_id: คลังสินค้าสำเร็จรูป 1: Receipts (ID: 1)
2025-12-01 15:11:34,353 - INFO - Created PO BOEP6805009 with ID 149
2025-12-01 15:11:34,358 - INFO - [18/468] Processing PO: BOEP6805010 (1 lines)
2025-12-01 15:11:34,890 - INFO - Using picking_type_id: คลังสินค้าสำเร็จรูป 1: Receipts (ID: 1)
2025-12-01 15:11:35,218 - INFO - Created PO BOEP6805010 with ID 150
2025-12-01 15:11:35,223 - INFO - [19/468] Processing PO: BOEP6805011 (1 lines)
2025-12-01 15:11:35,781 - INFO - Using picking_type_id: คลังสินค้าสำเร็จรูป 1: Receipts (ID: 1)
2025-12-01 15:11:36,118 - INFO - Created PO BOEP6805011 with ID 151
2025-12-01 15:11:36,123 - INFO - [20/468] Processing PO: BOEP6805012 (1 lines)
2025-12-01 15:11:36,667 - INFO - Using picking_type_id: คลังสินค้าสำเร็จรูป 1: Receipts (ID: 1)
2025-12-01 15:11:37,026 - INFO - Created PO BOEP6805012 with ID 152
2025-12-01 15:11:37,030 - INFO - [21/468] Processing PO: BOEP6805014 (1 lines)
2025-12-01 15:11:37,569 - INFO - Using picking_type_id: คลังสินค้าสำเร็จรูป 1: Receipts (ID: 1)
2025-12-01 15:11:37,942 - INFO - Created PO BOEP6805014 with ID 153
2025-12-01 15:11:37,946 - INFO - [22/468] Processing PO: BOEP6805015 (1 lines)
2025-12-01 15:11:38,490 - INFO - Using picking_type_id: คลังสินค้าสำเร็จรูป 1: Receipts (ID: 1)
2025-12-01 15:11:38,840 - INFO - Created PO BOEP6805015 with ID 154
2025-12-01 15:11:38,846 - INFO - [23/468] Processing PO: BOEP6805016 (1 lines)
2025-12-01 15:11:39,403 - INFO - Using picking_type_id: คลังสินค้าสำเร็จรูป 1: Receipts (ID: 1)
2025-12-01 15:11:39,705 - INFO - Created PO BOEP6805016 with ID 155
2025-12-01 15:11:39,708 - INFO - [24/468] Processing PO: BOEP6810002 (1 lines)
2025-12-01 15:11:39,902 - INFO - [25/468] Processing PO: CR18030032 (1 lines)
2025-12-01 15:11:40,057 - INFO - [26/468] Processing PO: CR18060039 (1 lines)
2025-12-01 15:11:40,214 - INFO - [27/468] Processing PO: CR18090037 (1 lines)
2025-12-01 15:11:40,384 - INFO - [28/468] Processing PO: CR22020024 (1 lines)
2025-12-01 15:11:40,529 - INFO - [29/468] Processing PO: CR22020025 (1 lines)
2025-12-01 15:11:40,686 - INFO - [30/468] Processing PO: CR22020026 (1 lines)
2025-12-01 15:11:40,904 - INFO - [31/468] Processing PO: CR22020027 (1 lines)
2025-12-01 15:11:41,057 - INFO - [32/468] Processing PO: CR22030035 (1 lines)
2025-12-01 15:11:41,227 - INFO - [33/468] Processing PO: CR22030036 (1 lines)
2025-12-01 15:11:41,390 - INFO - [34/468] Processing PO: CR22040028 (1 lines)
2025-12-01 15:11:41,549 - INFO - [35/468] Processing PO: CR22040029 (1 lines)
2025-12-01 15:11:41,725 - INFO - [36/468] Processing PO: CR22050027 (1 lines)
2025-12-01 15:11:41,884 - INFO - [37/468] Processing PO: CR22060036 (1 lines)
2025-12-01 15:11:42,044 - INFO - [38/468] Processing PO: CR22070032 (1 lines)
2025-12-01 15:11:42,212 - INFO - [39/468] Processing PO: CR22080026 (1 lines)
2025-12-01 15:11:42,373 - INFO - [40/468] Processing PO: CR22090030 (1 lines)
2025-12-01 15:11:42,524 - INFO - [41/468] Processing PO: CR22090031 (1 lines)
2025-12-01 15:11:42,720 - INFO - [42/468] Processing PO: CR22100024 (1 lines)
2025-12-01 15:11:42,892 - INFO - [43/468] Processing PO: CR22110028 (1 lines)
2025-12-01 15:11:43,051 - INFO - [44/468] Processing PO: CR23040027 (1 lines)
2025-12-01 15:11:43,193 - INFO - [45/468] Processing PO: CR23040031 (1 lines)
2025-12-01 15:11:43,381 - INFO - [46/468] Processing PO: CR23090039 (1 lines)
2025-12-01 15:11:43,534 - INFO - [47/468] Processing PO: CR23110025 (1 lines)
2025-12-01 15:11:43,699 - INFO - [48/468] Processing PO: CR23120031 (1 lines)
2025-12-01 15:11:43,870 - INFO - [49/468] Processing PO: CR23120049 (1 lines)
2025-12-01 15:11:44,020 - INFO - [50/468] Processing PO: CR23120050 (1 lines)
2025-12-01 15:11:44,176 - INFO - [51/468] Processing PO: CR24010028 (1 lines)
2025-12-01 15:11:44,338 - INFO - [52/468] Processing PO: CR24060025 (1 lines)
2025-12-01 15:11:44,494 - INFO - [53/468] Processing PO: CR24060026 (1 lines)
2025-12-01 15:11:44,701 - INFO - [54/468] Processing PO: CR24070016 (1 lines)
2025-12-01 15:11:44,865 - INFO - [55/468] Processing PO: CR24070017 (1 lines)
2025-12-01 15:11:45,022 - INFO - [56/468] Processing PO: CR24070054 (1 lines)
2025-12-01 15:11:45,180 - INFO - [57/468] Processing PO: CR24070061 (1 lines)
2025-12-01 15:11:45,334 - INFO - [58/468] Processing PO: CR24070062 (1 lines)
2025-12-01 15:11:45,479 - INFO - [59/468] Processing PO: CR24070079 (1 lines)
2025-12-01 15:11:45,655 - INFO - [60/468] Processing PO: CR24070080 (1 lines)
2025-12-01 15:11:45,818 - INFO - [61/468] Processing PO: CR24080023 (1 lines)
2025-12-01 15:11:45,980 - INFO - [62/468] Processing PO: CR24080025 (1 lines)
2025-12-01 15:11:46,140 - INFO - [63/468] Processing PO: CR24080026 (1 lines)
2025-12-01 15:11:46,316 - INFO - [64/468] Processing PO: CR24080071 (1 lines)
2025-12-01 15:11:46,475 - INFO - [65/468] Processing PO: CR24090001 (1 lines)
2025-12-01 15:11:46,657 - INFO - [66/468] Processing PO: CR24090027 (1 lines)
2025-12-01 15:11:46,822 - INFO - [67/468] Processing PO: CR24090028 (1 lines)
2025-12-01 15:11:46,982 - INFO - [68/468] Processing PO: CR24090029 (1 lines)
2025-12-01 15:11:47,182 - INFO - [69/468] Processing PO: CR24090030 (1 lines)
2025-12-01 15:11:47,349 - INFO - [70/468] Processing PO: CR24090031 (1 lines)
2025-12-01 15:11:47,511 - INFO - [71/468] Processing PO: CR24090032 (1 lines)
2025-12-01 15:11:47,697 - INFO - [72/468] Processing PO: CR24090033 (1 lines)
2025-12-01 15:11:47,862 - INFO - [73/468] Processing PO: CR24090034 (1 lines)
2025-12-01 15:11:48,030 - INFO - [74/468] Processing PO: CR24090035 (1 lines)
2025-12-01 15:11:48,213 - INFO - [75/468] Processing PO: CR24090048 (1 lines)
2025-12-01 15:11:48,373 - INFO - [76/468] Processing PO: CR24090051 (1 lines)
2025-12-01 15:11:48,533 - INFO - [77/468] Processing PO: CR24090053 (1 lines)
2025-12-01 15:11:48,709 - INFO - [78/468] Processing PO: CR24100029 (1 lines)
2025-12-01 15:11:48,881 - INFO - [79/468] Processing PO: CR24100033 (1 lines)
2025-12-01 15:11:49,044 - INFO - [80/468] Processing PO: CR24100034 (1 lines)
2025-12-01 15:11:49,210 - INFO - [81/468] Processing PO: CR24100035 (1 lines)
2025-12-01 15:11:49,385 - INFO - [82/468] Processing PO: CR24110021 (1 lines)
2025-12-01 15:11:49,564 - INFO - [83/468] Processing PO: CR24110022 (1 lines)
2025-12-01 15:11:49,718 - INFO - [84/468] Processing PO: CR24110026 (1 lines)
2025-12-01 15:11:49,907 - INFO - [85/468] Processing PO: CR24120030 (1 lines)
2025-12-01 15:11:50,063 - INFO - [86/468] Processing PO: CR24120032 (1 lines)
2025-12-01 15:11:50,224 - INFO - [87/468] Processing PO: CR24120037 (1 lines)
2025-12-01 15:11:50,396 - INFO - [88/468] Processing PO: CR24120040 (1 lines)
2025-12-01 15:11:50,567 - INFO - [89/468] Processing PO: CR24120046 (1 lines)
2025-12-01 15:11:50,800 - INFO - [90/468] Processing PO: CR25030025 (1 lines)
2025-12-01 15:11:51,006 - INFO - [91/468] Processing PO: CR25030026 (1 lines)
2025-12-01 15:11:51,193 - INFO - [92/468] Processing PO: CR25030027 (1 lines)
2025-12-01 15:11:51,369 - INFO - [93/468] Processing PO: CR25030028 (1 lines)
2025-12-01 15:11:51,525 - INFO - [94/468] Processing PO: CR25030029 (1 lines)
2025-12-01 15:11:51,698 - INFO - [95/468] Processing PO: CR25030032 (1 lines)
2025-12-01 15:11:51,877 - INFO - [96/468] Processing PO: CR25030033 (1 lines)
2025-12-01 15:11:52,095 - INFO - [97/468] Processing PO: CR25030034 (1 lines)
2025-12-01 15:11:52,538 - INFO - [98/468] Processing PO: CR25050012 (1 lines)
2025-12-01 15:11:52,931 - INFO - [99/468] Processing PO: CR25050013 (1 lines)
2025-12-01 15:11:53,081 - INFO - [100/468] Processing PO: CR25060011 (1 lines)
2025-12-01 15:11:53,255 - INFO - [101/468] Processing PO: CR25060012 (1 lines)
2025-12-01 15:11:53,395 - INFO - [102/468] Processing PO: CR25060013 (1 lines)
2025-12-01 15:11:53,551 - INFO - [103/468] Processing PO: CR25060014 (1 lines)
2025-12-01 15:11:53,743 - INFO - [104/468] Processing PO: CR25060015 (1 lines)
2025-12-01 15:11:53,897 - INFO - [105/468] Processing PO: CR25060016 (1 lines)
2025-12-01 15:11:54,069 - INFO - [106/468] Processing PO: CR25060017 (1 lines)
2025-12-01 15:11:54,290 - INFO - [107/468] Processing PO: CR25060018 (1 lines)
2025-12-01 15:11:54,457 - INFO - [108/468] Processing PO: CR25060020 (1 lines)
2025-12-01 15:11:54,636 - INFO - [109/468] Processing PO: CR25060021 (1 lines)
2025-12-01 15:11:54,805 - INFO - [110/468] Processing PO: CR25070010 (1 lines)
2025-12-01 15:11:54,991 - INFO - [111/468] Processing PO: CR25070011 (1 lines)
2025-12-01 15:11:55,146 - INFO - [112/468] Processing PO: CR25070012 (1 lines)
2025-12-01 15:11:55,331 - INFO - [113/468] Processing PO: CR25070013 (1 lines)
2025-12-01 15:11:55,492 - INFO - [114/468] Processing PO: CR25070014 (1 lines)
2025-12-01 15:11:55,656 - INFO - [115/468] Processing PO: CR25070016 (1 lines)
2025-12-01 15:11:55,853 - INFO - [116/468] Processing PO: CR25070017 (1 lines)
2025-12-01 15:11:56,018 - INFO - [117/468] Processing PO: CR25070018 (1 lines)
2025-12-01 15:11:56,183 - INFO - [118/468] Processing PO: CR25070020 (1 lines)
2025-12-01 15:11:56,359 - INFO - [119/468] Processing PO: CR25070021 (1 lines)
2025-12-01 15:11:56,519 - INFO - [120/468] Processing PO: CR25070022 (1 lines)
2025-12-01 15:11:56,686 - INFO - [121/468] Processing PO: CR25070024 (1 lines)
2025-12-01 15:11:56,868 - INFO - [122/468] Processing PO: CR25070025 (1 lines)
2025-12-01 15:11:57,024 - INFO - [123/468] Processing PO: CR25070026 (1 lines)
2025-12-01 15:11:57,197 - INFO - [124/468] Processing PO: CR25070027 (1 lines)
2025-12-01 15:11:57,369 - INFO - [125/468] Processing PO: CR25070028 (1 lines)
2025-12-01 15:11:57,525 - INFO - [126/468] Processing PO: CR25070029 (1 lines)
2025-12-01 15:11:57,707 - INFO - [127/468] Processing PO: CR25070030 (1 lines)
2025-12-01 15:11:57,880 - INFO - [128/468] Processing PO: CR25070031 (1 lines)
2025-12-01 15:11:58,038 - INFO - [129/468] Processing PO: CR25070032 (1 lines)
2025-12-01 15:11:58,198 - INFO - [130/468] Processing PO: CR25070033 (1 lines)
2025-12-01 15:11:58,364 - INFO - [131/468] Processing PO: CR25070034 (1 lines)
2025-12-01 15:11:58,533 - INFO - [132/468] Processing PO: CR25070035 (1 lines)
2025-12-01 15:11:58,697 - INFO - [133/468] Processing PO: CR25070036 (1 lines)
2025-12-01 15:11:58,892 - INFO - [134/468] Processing PO: CR25070037 (1 lines)
2025-12-01 15:11:59,046 - INFO - [135/468] Processing PO: CR25080013 (1 lines)
2025-12-01 15:11:59,214 - INFO - [136/468] Processing PO: CR25080014 (1 lines)
2025-12-01 15:11:59,382 - INFO - [137/468] Processing PO: CR25080015 (1 lines)
2025-12-01 15:11:59,556 - INFO - [138/468] Processing PO: CR25080016 (1 lines)
2025-12-01 15:11:59,724 - INFO - [139/468] Processing PO: CR25080022 (1 lines)
2025-12-01 15:11:59,891 - INFO - [140/468] Processing PO: CR25080023 (1 lines)
2025-12-01 15:12:00,062 - INFO - [141/468] Processing PO: CR25080024 (1 lines)
2025-12-01 15:12:00,218 - INFO - [142/468] Processing PO: CR25080028 (1 lines)
2025-12-01 15:12:00,386 - INFO - [143/468] Processing PO: CR25080031 (1 lines)
2025-12-01 15:12:00,553 - INFO - [144/468] Processing PO: CR25080032 (1 lines)
2025-12-01 15:12:00,712 - INFO - [145/468] Processing PO: CR25080033 (1 lines)
2025-12-01 15:12:00,893 - INFO - [146/468] Processing PO: CR25080034 (1 lines)
2025-12-01 15:12:01,046 - INFO - [147/468] Processing PO: CR25090002 (1 lines)
2025-12-01 15:12:01,206 - INFO - [148/468] Processing PO: CR25090003 (1 lines)
2025-12-01 15:12:01,368 - INFO - [149/468] Processing PO: CR25090004 (1 lines)
2025-12-01 15:12:01,524 - INFO - [150/468] Processing PO: CR25090005 (1 lines)
2025-12-01 15:12:01,670 - INFO - [151/468] Processing PO: CR25090006 (1 lines)
2025-12-01 15:12:01,841 - INFO - [152/468] Processing PO: CR25090007 (1 lines)
2025-12-01 15:12:01,988 - INFO - [153/468] Processing PO: CR25090008 (1 lines)
2025-12-01 15:12:02,143 - INFO - [154/468] Processing PO: CR25090009 (1 lines)
2025-12-01 15:12:02,310 - INFO - [155/468] Processing PO: CR25090010 (1 lines)
2025-12-01 15:12:02,477 - INFO - [156/468] Processing PO: CR25090011 (1 lines)
2025-12-01 15:12:02,645 - INFO - [157/468] Processing PO: CR25090012 (1 lines)
2025-12-01 15:12:02,823 - INFO - [158/468] Processing PO: CR25090013 (1 lines)
2025-12-01 15:12:02,971 - INFO - [159/468] Processing PO: CR25090014 (1 lines)
2025-12-01 15:12:03,121 - INFO - [160/468] Processing PO: CR25090019 (1 lines)
2025-12-01 15:12:03,296 - INFO - [161/468] Processing PO: CR25090020 (1 lines)
2025-12-01 15:12:03,483 - INFO - [162/468] Processing PO: CR25090030 (1 lines)
2025-12-01 15:12:03,641 - INFO - [163/468] Processing PO: CR25090031 (1 lines)
2025-12-01 15:12:03,812 - INFO - [164/468] Processing PO: CR25090032 (1 lines)
2025-12-01 15:12:03,992 - INFO - [165/468] Processing PO: CR25090033 (1 lines)
2025-12-01 15:12:04,159 - INFO - [166/468] Processing PO: CR25090034 (1 lines)
2025-12-01 15:12:04,360 - INFO - [167/468] Processing PO: CR25090035 (1 lines)
2025-12-01 15:12:04,534 - INFO - [168/468] Processing PO: CR25090036 (1 lines)
2025-12-01 15:12:04,693 - INFO - [169/468] Processing PO: CR25090037 (1 lines)
2025-12-01 15:12:04,867 - INFO - [170/468] Processing PO: CR25090038 (1 lines)
2025-12-01 15:12:05,040 - INFO - [171/468] Processing PO: CR25090039 (1 lines)
2025-12-01 15:12:05,183 - INFO - [172/468] Processing PO: CR25090040 (1 lines)
2025-12-01 15:12:05,334 - INFO - [173/468] Processing PO: CR25090041 (1 lines)
2025-12-01 15:12:05,504 - INFO - [174/468] Processing PO: CR25090042 (1 lines)
2025-12-01 15:12:05,660 - INFO - [175/468] Processing PO: CR25090043 (1 lines)
2025-12-01 15:12:05,812 - INFO - [176/468] Processing PO: CR25090044 (1 lines)
2025-12-01 15:12:05,973 - INFO - [177/468] Processing PO: CR25090045 (1 lines)
2025-12-01 15:12:06,150 - INFO - [178/468] Processing PO: CR25090046 (1 lines)
2025-12-01 15:12:06,367 - INFO - [179/468] Processing PO: CR25090047 (1 lines)
2025-12-01 15:12:06,618 - INFO - [180/468] Processing PO: CR25090048 (1 lines)
2025-12-01 15:12:06,808 - INFO - [181/468] Processing PO: CR25090049 (1 lines)
2025-12-01 15:12:06,984 - INFO - [182/468] Processing PO: CR25100001 (1 lines)
2025-12-01 15:12:07,150 - INFO - [183/468] Processing PO: CR25100002 (1 lines)
2025-12-01 15:12:07,303 - INFO - [184/468] Processing PO: CR25100003 (1 lines)
2025-12-01 15:12:07,485 - INFO - [185/468] Processing PO: CR25100004 (1 lines)
2025-12-01 15:12:07,637 - INFO - [186/468] Processing PO: CR25100005 (1 lines)
2025-12-01 15:12:07,794 - INFO - [187/468] Processing PO: CR25100006 (1 lines)
2025-12-01 15:12:07,978 - INFO - [188/468] Processing PO: CR25100007 (1 lines)
2025-12-01 15:12:08,134 - INFO - [189/468] Processing PO: CR25100008 (1 lines)
2025-12-01 15:12:08,298 - INFO - [190/468] Processing PO: CR25100009 (1 lines)
2025-12-01 15:12:08,460 - INFO - [191/468] Processing PO: CR25100010 (1 lines)
2025-12-01 15:12:08,635 - INFO - [192/468] Processing PO: CR25100011 (1 lines)
2025-12-01 15:12:08,808 - INFO - [193/468] Processing PO: CR25100012 (1 lines)
2025-12-01 15:12:08,987 - INFO - [194/468] Processing PO: CR25100013 (1 lines)
2025-12-01 15:12:09,154 - INFO - [195/468] Processing PO: CR25100014 (1 lines)
2025-12-01 15:12:09,332 - INFO - [196/468] Processing PO: CR25100015 (1 lines)
2025-12-01 15:12:09,490 - INFO - [197/468] Processing PO: CR25100016 (1 lines)
2025-12-01 15:12:09,671 - INFO - [198/468] Processing PO: CR25100017 (1 lines)
2025-12-01 15:12:09,899 - INFO - [199/468] Processing PO: CR25100018 (1 lines)
2025-12-01 15:12:10,125 - INFO - [200/468] Processing PO: CR25100019 (1 lines)
2025-12-01 15:12:10,408 - INFO - [201/468] Processing PO: CR25100020 (1 lines)
2025-12-01 15:12:10,679 - INFO - [202/468] Processing PO: CR25100021 (1 lines)
2025-12-01 15:12:10,985 - INFO - [203/468] Processing PO: CR25100022 (1 lines)
2025-12-01 15:12:11,171 - INFO - [204/468] Processing PO: CR25100023 (1 lines)
2025-12-01 15:12:11,362 - INFO - [205/468] Processing PO: CR25100024 (1 lines)
2025-12-01 15:12:11,506 - INFO - [206/468] Processing PO: CR25100025 (1 lines)
2025-12-01 15:12:11,694 - INFO - [207/468] Processing PO: CR25100026 (1 lines)
2025-12-01 15:12:11,873 - INFO - [208/468] Processing PO: CR25100027 (1 lines)
2025-12-01 15:12:12,035 - INFO - [209/468] Processing PO: CR25100028 (1 lines)
2025-12-01 15:12:12,189 - INFO - [210/468] Processing PO: CR25100029 (1 lines)
2025-12-01 15:12:12,366 - INFO - [211/468] Processing PO: CR25100030 (1 lines)
2025-12-01 15:12:12,563 - INFO - [212/468] Processing PO: CR25100031 (1 lines)
2025-12-01 15:12:12,739 - INFO - [213/468] Processing PO: CR25100032 (1 lines)
2025-12-01 15:12:12,913 - INFO - [214/468] Processing PO: CR25100033 (1 lines)
2025-12-01 15:12:13,064 - INFO - [215/468] Processing PO: CR25100034 (1 lines)
2025-12-01 15:12:13,216 - INFO - [216/468] Processing PO: CR25100035 (1 lines)
2025-12-01 15:12:13,384 - INFO - [217/468] Processing PO: CR25100036 (1 lines)
2025-12-01 15:12:13,561 - INFO - [218/468] Processing PO: CR25100037 (1 lines)
2025-12-01 15:12:13,728 - INFO - [219/468] Processing PO: CR25100038 (1 lines)
2025-12-01 15:12:13,901 - INFO - [220/468] Processing PO: CR25100039 (1 lines)
2025-12-01 15:12:14,100 - INFO - [221/468] Processing PO: CR25100040 (1 lines)
2025-12-01 15:12:14,287 - INFO - [222/468] Processing PO: CR25100041 (1 lines)
2025-12-01 15:12:14,452 - INFO - [223/468] Processing PO: OEP6010122 (1 lines)
2025-12-01 15:12:14,608 - INFO - [224/468] Processing PO: OEP6012145 (1 lines)
2025-12-01 15:12:14,787 - INFO - [225/468] Processing PO: OEP6105060 (1 lines)
2025-12-01 15:12:14,946 - INFO - [226/468] Processing PO: OEP6107104 (1 lines)
2025-12-01 15:12:15,542 - INFO - Using picking_type_id: คลังสินค้าสำเร็จรูป 1: Receipts (ID: 1)
2025-12-01 15:12:15,939 - INFO - Created PO OEP6107104 with ID 157
2025-12-01 15:12:15,949 - INFO - [227/468] Processing PO: OEP6107114 (1 lines)
2025-12-01 15:12:16,529 - INFO - Using picking_type_id: คลังสินค้าสำเร็จรูป 1: Receipts (ID: 1)
2025-12-01 15:12:16,887 - INFO - Created PO OEP6107114 with ID 158
2025-12-01 15:12:16,894 - INFO - [228/468] Processing PO: OEP6112064 (1 lines)
2025-12-01 15:12:17,492 - INFO - Using picking_type_id: คลังสินค้าสำเร็จรูป 1: Receipts (ID: 1)
2025-12-01 15:12:17,907 - INFO - Created PO OEP6112064 with ID 159
2025-12-01 15:12:17,910 - INFO - [229/468] Processing PO: OEP6112137 (1 lines)
2025-12-01 15:12:18,139 - INFO - [230/468] Processing PO: OEP6112144 (1 lines)
2025-12-01 15:12:18,859 - INFO - Using picking_type_id: คลังสินค้าสำเร็จรูป 1: Receipts (ID: 1)
2025-12-01 15:12:19,351 - INFO - Created PO OEP6112144 with ID 160
2025-12-01 15:12:19,354 - INFO - [231/468] Processing PO: OEP6201106 (1 lines)
2025-12-01 15:12:19,565 - INFO - [232/468] Processing PO: OEP6204133 (1 lines)
2025-12-01 15:12:19,742 - INFO - [233/468] Processing PO: OEP6205108 (1 lines)
2025-12-01 15:12:19,910 - INFO - [234/468] Processing PO: OEP6209076 (1 lines)
2025-12-01 15:12:20,568 - INFO - Using picking_type_id: คลังสินค้าสำเร็จรูป 1: Receipts (ID: 1)
2025-12-01 15:12:20,949 - INFO - Created PO OEP6209076 with ID 161
2025-12-01 15:12:20,958 - INFO - [235/468] Processing PO: OEP6210085 (1 lines)
2025-12-01 15:12:21,129 - INFO - [236/468] Processing PO: OEP6306069 (1 lines)
2025-12-01 15:12:21,747 - INFO - Using picking_type_id: คลังสินค้าสำเร็จรูป 1: Receipts (ID: 1)
2025-12-01 15:12:22,059 - INFO - Created PO OEP6306069 with ID 162
2025-12-01 15:12:22,064 - INFO - [237/468] Processing PO: OEP6307037 (1 lines)
2025-12-01 15:12:22,218 - INFO - [238/468] Processing PO: OEP6311050 (1 lines)
2025-12-01 15:12:22,386 - INFO - [239/468] Processing PO: OEP6312085 (1 lines)
2025-12-01 15:12:22,554 - INFO - [240/468] Processing PO: OEP6312096 (1 lines)
2025-12-01 15:12:22,705 - INFO - [241/468] Processing PO: OEP6312097 (1 lines)
2025-12-01 15:12:22,859 - INFO - [242/468] Processing PO: OEP6407067 (1 lines)
2025-12-01 15:12:23,023 - INFO - [243/468] Processing PO: OEP6409070 (1 lines)
2025-12-01 15:12:23,194 - INFO - [244/468] Processing PO: OEP6410070 (1 lines)
2025-12-01 15:12:23,362 - INFO - [245/468] Processing PO: OEP6411068 (1 lines)
2025-12-01 15:12:23,520 - INFO - [246/468] Processing PO: OEP6412069 (1 lines)
2025-12-01 15:12:23,752 - INFO - [247/468] Processing PO: OEP6501065 (1 lines)
2025-12-01 15:12:24,066 - INFO - [248/468] Processing PO: OEP6503083 (1 lines)
2025-12-01 15:12:24,376 - INFO - [249/468] Processing PO: OEP6506067 (1 lines)
2025-12-01 15:12:24,576 - INFO - [250/468] Processing PO: OEP6506087 (1 lines)
2025-12-01 15:12:24,745 - INFO - [251/468] Processing PO: OEP6508048 (1 lines)
2025-12-01 15:12:24,906 - INFO - [252/468] Processing PO: OEP6508080 (1 lines)
2025-12-01 15:12:25,059 - INFO - [253/468] Processing PO: OEP6509038 (1 lines)
2025-12-01 15:12:25,245 - INFO - [254/468] Processing PO: OEP6509082 (1 lines)
2025-12-01 15:12:25,429 - INFO - [255/468] Processing PO: OEP6509086 (1 lines)
2025-12-01 15:12:25,599 - INFO - [256/468] Processing PO: OEP6510058 (1 lines)
2025-12-01 15:12:25,786 - INFO - [257/468] Processing PO: OEP6510059 (1 lines)
2025-12-01 15:12:25,952 - INFO - [258/468] Processing PO: OEP6510060 (1 lines)
2025-12-01 15:12:26,113 - INFO - [259/468] Processing PO: OEP6510061 (1 lines)
2025-12-01 15:12:26,256 - INFO - [260/468] Processing PO: OEP6510062 (1 lines)
2025-12-01 15:12:26,408 - INFO - [261/468] Processing PO: OEP6511064 (1 lines)
2025-12-01 15:12:26,570 - INFO - [262/468] Processing PO: OEP6512076 (1 lines)
2025-12-01 15:12:26,728 - INFO - [263/468] Processing PO: OEP6512077 (1 lines)
2025-12-01 15:12:26,891 - INFO - [264/468] Processing PO: OEP6512078 (1 lines)
2025-12-01 15:12:27,077 - INFO - [265/468] Processing PO: OEP6512080 (1 lines)
2025-12-01 15:12:27,255 - INFO - [266/468] Processing PO: OEP6512083 (1 lines)
2025-12-01 15:12:27,527 - INFO - [267/468] Processing PO: OEP6512096 (1 lines)
2025-12-01 15:12:27,730 - INFO - [268/468] Processing PO: OEP6605071 (1 lines)
2025-12-01 15:12:27,888 - INFO - [269/468] Processing PO: OEP6606042 (1 lines)
2025-12-01 15:12:28,058 - INFO - [270/468] Processing PO: OEP6607081 (1 lines)
2025-12-01 15:12:28,219 - INFO - [271/468] Processing PO: OEP6609064 (1 lines)
2025-12-01 15:12:28,370 - INFO - [272/468] Processing PO: OEP6609079 (1 lines)
2025-12-01 15:12:28,636 - INFO - [273/468] Processing PO: OEP6610049 (1 lines)
2025-12-01 15:12:28,791 - INFO - [274/468] Processing PO: OEP6610074 (1 lines)
2025-12-01 15:12:28,952 - INFO - [275/468] Processing PO: OEP6611053 (1 lines)
2025-12-01 15:12:29,133 - INFO - [276/468] Processing PO: OEP6612042 (1 lines)
2025-12-01 15:12:29,302 - INFO - [277/468] Processing PO: OEP6612046 (1 lines)
2025-12-01 15:12:29,462 - INFO - [278/468] Processing PO: OEP6701075 (1 lines)
2025-12-01 15:12:29,629 - INFO - [279/468] Processing PO: OEP6701076 (1 lines)
2025-12-01 15:12:29,795 - INFO - [280/468] Processing PO: OEP6702072 (1 lines)
2025-12-01 15:12:29,962 - INFO - [281/468] Processing PO: OEP6702073 (1 lines)
2025-12-01 15:12:30,190 - INFO - [282/468] Processing PO: OEP6703052 (1 lines)
2025-12-01 15:12:30,334 - INFO - [283/468] Processing PO: OEP6703077 (1 lines)
2025-12-01 15:12:30,489 - INFO - [284/468] Processing PO: OEP6703078 (1 lines)
2025-12-01 15:12:30,670 - INFO - [285/468] Processing PO: OEP6704067 (1 lines)
2025-12-01 15:12:30,835 - INFO - [286/468] Processing PO: OEP6704068 (1 lines)
2025-12-01 15:12:31,097 - INFO - [287/468] Processing PO: OEP6705039 (1 lines)
2025-12-01 15:12:31,296 - INFO - [288/468] Processing PO: OEP6706037 (1 lines)
2025-12-01 15:12:31,456 - INFO - [289/468] Processing PO: OEP6706038 (1 lines)
2025-12-01 15:12:31,637 - INFO - [290/468] Processing PO: OEP6706057 (1 lines)
2025-12-01 15:12:31,802 - INFO - [291/468] Processing PO: OEP6706069 (1 lines)
2025-12-01 15:12:32,140 - INFO - [292/468] Processing PO: OEP6706070 (1 lines)
2025-12-01 15:12:32,296 - INFO - [293/468] Processing PO: OEP6706074 (1 lines)
2025-12-01 15:12:32,450 - INFO - [294/468] Processing PO: OEP6707023 (1 lines)
2025-12-01 15:12:32,631 - INFO - [295/468] Processing PO: OEP6707044 (1 lines)
2025-12-01 15:12:32,858 - INFO - [296/468] Processing PO: OEP6707048 (1 lines)
2025-12-01 15:12:33,051 - INFO - [297/468] Processing PO: OEP6708031 (1 lines)
2025-12-01 15:12:33,208 - INFO - [298/468] Processing PO: OEP6709040 (1 lines)
2025-12-01 15:12:33,375 - INFO - [299/468] Processing PO: OEP6709042 (1 lines)
2025-12-01 15:12:33,543 - INFO - [300/468] Processing PO: OEP6709055 (1 lines)
2025-12-01 15:12:33,712 - INFO - [301/468] Processing PO: OEP6709056 (1 lines)
2025-12-01 15:12:33,948 - INFO - [302/468] Processing PO: OEP6709057 (1 lines)
2025-12-01 15:12:34,109 - INFO - [303/468] Processing PO: OEP6709060 (1 lines)
2025-12-01 15:12:34,290 - INFO - [304/468] Processing PO: OEP6709079 (1 lines)
2025-12-01 15:12:34,445 - INFO - [305/468] Processing PO: OEP6709092 (1 lines)
2025-12-01 15:12:34,643 - INFO - [306/468] Processing PO: OEP6710053/1 (1 lines)
2025-12-01 15:12:35,225 - INFO - Using picking_type_id: คลังสินค้าสำเร็จรูป 1: Receipts (ID: 1)
2025-12-01 15:12:35,572 - INFO - Created PO OEP6710053/1 with ID 163
2025-12-01 15:12:35,581 - INFO - [307/468] Processing PO: OEP6710053/2 (1 lines)
2025-12-01 15:12:36,135 - INFO - Using picking_type_id: คลังสินค้าสำเร็จรูป 1: Receipts (ID: 1)
2025-12-01 15:12:36,544 - INFO - Created PO OEP6710053/2 with ID 164
2025-12-01 15:12:36,553 - INFO - [308/468] Processing PO: OEP6710053/3 (1 lines)
2025-12-01 15:12:37,172 - INFO - Using picking_type_id: คลังสินค้าสำเร็จรูป 1: Receipts (ID: 1)
2025-12-01 15:12:37,598 - INFO - Created PO OEP6710053/3 with ID 165
2025-12-01 15:12:37,607 - INFO - [309/468] Processing PO: OEP6710053/4 (1 lines)
2025-12-01 15:12:38,306 - INFO - Using picking_type_id: คลังสินค้าสำเร็จรูป 1: Receipts (ID: 1)
2025-12-01 15:12:38,662 - INFO - Created PO OEP6710053/4 with ID 166
2025-12-01 15:12:38,666 - INFO - [310/468] Processing PO: OEP6710053/5 (1 lines)
2025-12-01 15:12:39,206 - INFO - Using picking_type_id: คลังสินค้าสำเร็จรูป 1: Receipts (ID: 1)
2025-12-01 15:12:39,556 - INFO - Created PO OEP6710053/5 with ID 167
2025-12-01 15:12:39,565 - INFO - [311/468] Processing PO: OEP6710053/6 (1 lines)
2025-12-01 15:12:40,141 - INFO - Using picking_type_id: คลังสินค้าสำเร็จรูป 1: Receipts (ID: 1)
2025-12-01 15:12:40,489 - INFO - Created PO OEP6710053/6 with ID 168
2025-12-01 15:12:40,498 - INFO - [312/468] Processing PO: OEP6710059 (1 lines)
2025-12-01 15:12:40,676 - INFO - [313/468] Processing PO: OEP6710061 (1 lines)
2025-12-01 15:12:40,832 - INFO - [314/468] Processing PO: OEP6710063 (1 lines)
2025-12-01 15:12:41,012 - INFO - [315/468] Processing PO: OEP6710064 (1 lines)
2025-12-01 15:12:41,168 - INFO - [316/468] Processing PO: OEP6711051 (1 lines)
2025-12-01 15:12:41,310 - INFO - [317/468] Processing PO: OEP6711052 (1 lines)
2025-12-01 15:12:41,486 - INFO - [318/468] Processing PO: OEP6711053 (1 lines)
2025-12-01 15:12:41,647 - INFO - [319/468] Processing PO: OEP6711055 (1 lines)
2025-12-01 15:12:41,799 - INFO - [320/468] Processing PO: OEP6712056 (1 lines)
2025-12-01 15:12:41,980 - INFO - [321/468] Processing PO: OEP6712057 (1 lines)
2025-12-01 15:12:42,151 - INFO - [322/468] Processing PO: OEP6712060 (1 lines)
2025-12-01 15:12:42,310 - INFO - [323/468] Processing PO: OEP6712066 (1 lines)
2025-12-01 15:12:42,485 - INFO - [324/468] Processing PO: OEP6712067 (1 lines)
2025-12-01 15:12:42,657 - INFO - [325/468] Processing PO: OEP6712069 (1 lines)
2025-12-01 15:12:42,817 - INFO - [326/468] Processing PO: OEP6712095 (1 lines)
2025-12-01 15:12:42,974 - INFO - [327/468] Processing PO: OEP6802074 (1 lines)
2025-12-01 15:12:43,142 - INFO - [328/468] Processing PO: OEP6802075 (1 lines)
2025-12-01 15:12:43,302 - INFO - [329/468] Processing PO: OEP6802077 (1 lines)
2025-12-01 15:12:43,495 - INFO - [330/468] Processing PO: OEP6802079 (1 lines)
2025-12-01 15:12:43,660 - INFO - [331/468] Processing PO: OEP6803054 (1 lines)
2025-12-01 15:12:43,835 - INFO - [332/468] Processing PO: OEP6803056 (1 lines)
2025-12-01 15:12:44,000 - INFO - [333/468] Processing PO: OEP6803070 (1 lines)
2025-12-01 15:12:44,196 - INFO - [334/468] Processing PO: OEP6803071 (1 lines)
2025-12-01 15:12:44,405 - INFO - [335/468] Processing PO: OEP6803080 (1 lines)
2025-12-01 15:12:44,609 - INFO - [336/468] Processing PO: OEP6803081 (1 lines)
2025-12-01 15:12:44,790 - INFO - [337/468] Processing PO: OEP6803082 (1 lines)
2025-12-01 15:12:44,962 - INFO - [338/468] Processing PO: OEP6803085 (1 lines)
2025-12-01 15:12:45,123 - INFO - [339/468] Processing PO: OEP6803127 (1 lines)
2025-12-01 15:12:45,285 - INFO - [340/468] Processing PO: OEP6803129 (1 lines)
2025-12-01 15:12:45,462 - INFO - [341/468] Processing PO: OEP6803132 (1 lines)
2025-12-01 15:12:45,618 - INFO - [342/468] Processing PO: OEP6803133 (1 lines)
2025-12-01 15:12:45,778 - INFO - [343/468] Processing PO: OEP6803134 (1 lines)
2025-12-01 15:12:45,970 - INFO - [344/468] Processing PO: OEP6804028 (1 lines)
2025-12-01 15:12:46,132 - INFO - [345/468] Processing PO: OEP6804076 (1 lines)
2025-12-01 15:12:46,295 - INFO - [346/468] Processing PO: OEP6804078 (1 lines)
2025-12-01 15:12:46,461 - INFO - [347/468] Processing PO: OEP6804079 (1 lines)
2025-12-01 15:12:46,620 - INFO - [348/468] Processing PO: OEP6804088 (1 lines)
2025-12-01 15:12:46,788 - INFO - [349/468] Processing PO: OEP6804090 (1 lines)
2025-12-01 15:12:46,933 - INFO - [350/468] Processing PO: OEP6804101 (1 lines)
2025-12-01 15:12:47,100 - INFO - [351/468] Processing PO: OEP6804106 (1 lines)
2025-12-01 15:12:47,257 - INFO - [352/468] Processing PO: OEP6805005 (1 lines)
2025-12-01 15:12:47,777 - INFO - Using picking_type_id: คลังสินค้าสำเร็จรูป 1: Receipts (ID: 1)
2025-12-01 15:12:48,066 - INFO - Created PO OEP6805005 with ID 169
2025-12-01 15:12:48,076 - INFO - [353/468] Processing PO: OEP6805006 (1 lines)
2025-12-01 15:12:48,767 - INFO - Using picking_type_id: คลังสินค้าสำเร็จรูป 1: Receipts (ID: 1)
2025-12-01 15:12:49,064 - INFO - Created PO OEP6805006 with ID 170
2025-12-01 15:12:49,074 - INFO - [354/468] Processing PO: OEP6805007 (1 lines)
2025-12-01 15:12:49,605 - INFO - Using picking_type_id: คลังสินค้าสำเร็จรูป 1: Receipts (ID: 1)
2025-12-01 15:12:49,897 - INFO - Created PO OEP6805007 with ID 171
2025-12-01 15:12:49,899 - INFO - [355/468] Processing PO: OEP6805067 (1 lines)
2025-12-01 15:12:50,072 - INFO - [356/468] Processing PO: OEP6805068 (1 lines)
2025-12-01 15:12:50,231 - INFO - [357/468] Processing PO: OEP6805070 (1 lines)
2025-12-01 15:12:50,377 - INFO - [358/468] Processing PO: OEP6805088 (1 lines)
2025-12-01 15:12:50,520 - INFO - [359/468] Processing PO: OEP6805089 (1 lines)
2025-12-01 15:12:50,698 - INFO - [360/468] Processing PO: OEP6805091 (1 lines)
2025-12-01 15:12:50,858 - INFO - [361/468] Processing PO: OEP6806061 (1 lines)
2025-12-01 15:12:51,003 - INFO - [362/468] Processing PO: OEP6806062 (1 lines)
2025-12-01 15:12:51,170 - INFO - [363/468] Processing PO: OEP6806064 (1 lines)
2025-12-01 15:12:51,330 - INFO - [364/468] Processing PO: OEP6806065 (1 lines)
2025-12-01 15:12:51,504 - INFO - [365/468] Processing PO: OEP6806066 (1 lines)
2025-12-01 15:12:51,667 - INFO - [366/468] Processing PO: OEP6806068 (1 lines)
2025-12-01 15:12:51,825 - INFO - [367/468] Processing PO: OEP6806070 (1 lines)
2025-12-01 15:12:52,016 - INFO - [368/468] Processing PO: OEP6806071 (1 lines)
2025-12-01 15:12:52,175 - INFO - [369/468] Processing PO: OEP6806073 (1 lines)
2025-12-01 15:12:52,328 - INFO - [370/468] Processing PO: OEP6806075 (1 lines)
2025-12-01 15:12:52,502 - INFO - [371/468] Processing PO: OEP6806087 (1 lines)
2025-12-01 15:12:52,699 - INFO - [372/468] Processing PO: OEP6806088 (1 lines)
2025-12-01 15:12:52,858 - INFO - [373/468] Processing PO: OEP6806089 (1 lines)
2025-12-01 15:12:53,014 - INFO - [374/468] Processing PO: OEP6806090 (1 lines)
2025-12-01 15:12:53,187 - INFO - [375/468] Processing PO: OEP6806091 (1 lines)
2025-12-01 15:12:53,347 - INFO - [376/468] Processing PO: OEP6807077 (1 lines)
2025-12-01 15:12:53,505 - INFO - [377/468] Processing PO: OEP6807078 (1 lines)
2025-12-01 15:12:53,677 - INFO - [378/468] Processing PO: OEP6807079 (1 lines)
2025-12-01 15:12:53,837 - INFO - [379/468] Processing PO: OEP6807080 (1 lines)
2025-12-01 15:12:53,995 - INFO - [380/468] Processing PO: OEP6807087 (1 lines)
2025-12-01 15:12:54,174 - INFO - [381/468] Processing PO: OEP6807088 (1 lines)
2025-12-01 15:12:54,332 - INFO - [382/468] Processing PO: OEP6807093 (1 lines)
2025-12-01 15:12:54,494 - INFO - [383/468] Processing PO: OEP6807094 (1 lines)
2025-12-01 15:12:54,672 - INFO - [384/468] Processing PO: OEP6808046 (1 lines)
2025-12-01 15:12:54,821 - INFO - [385/468] Processing PO: OEP6808053 (1 lines)
2025-12-01 15:12:54,994 - INFO - [386/468] Processing PO: OEP6808054 (1 lines)
2025-12-01 15:12:55,156 - INFO - [387/468] Processing PO: OEP6808055 (1 lines)
2025-12-01 15:12:55,308 - INFO - [388/468] Processing PO: OEP6808056 (1 lines)
2025-12-01 15:12:55,461 - INFO - [389/468] Processing PO: OEP6808057 (1 lines)
2025-12-01 15:12:55,632 - INFO - [390/468] Processing PO: OEP6808058 (1 lines)
2025-12-01 15:12:55,792 - INFO - [391/468] Processing PO: OEP6808077 (1 lines)
2025-12-01 15:12:55,947 - INFO - [392/468] Processing PO: OEP6808078 (1 lines)
2025-12-01 15:12:56,124 - INFO - [393/468] Processing PO: OEP6808084 (1 lines)
2025-12-01 15:12:56,269 - INFO - [394/468] Processing PO: OEP6808085 (1 lines)
2025-12-01 15:12:56,424 - INFO - [395/468] Processing PO: OEP6808089 (1 lines)
2025-12-01 15:12:56,596 - INFO - [396/468] Processing PO: OEP6808091 (1 lines)
2025-12-01 15:12:56,761 - INFO - [397/468] Processing PO: OEP6809067 (1 lines)
2025-12-01 15:12:56,914 - INFO - [398/468] Processing PO: OEP6809068 (1 lines)
2025-12-01 15:12:57,072 - INFO - [399/468] Processing PO: OEP6809069 (1 lines)
2025-12-01 15:12:57,248 - INFO - [400/468] Processing PO: OEP6809070 (1 lines)
2025-12-01 15:12:57,394 - INFO - [401/468] Processing PO: OEP6809071 (1 lines)
2025-12-01 15:12:57,544 - INFO - [402/468] Processing PO: OEP6809072 (1 lines)
2025-12-01 15:12:57,699 - INFO - [403/468] Processing PO: OEP6809073 (1 lines)
2025-12-01 15:12:57,868 - INFO - [404/468] Processing PO: OEP6809074 (1 lines)
2025-12-01 15:12:58,031 - INFO - [405/468] Processing PO: OEP6809075 (1 lines)
2025-12-01 15:12:58,189 - INFO - [406/468] Processing PO: OEP6809076 (1 lines)
2025-12-01 15:12:58,362 - INFO - [407/468] Processing PO: OEP6809077 (1 lines)
2025-12-01 15:12:58,530 - INFO - [408/468] Processing PO: OEP6809078 (1 lines)
2025-12-01 15:12:58,693 - INFO - [409/468] Processing PO: OEP6809079 (1 lines)
2025-12-01 15:12:58,866 - INFO - [410/468] Processing PO: OEP6809080 (1 lines)
2025-12-01 15:12:59,024 - INFO - [411/468] Processing PO: OEP6809082 (1 lines)
2025-12-01 15:12:59,199 - INFO - [412/468] Processing PO: OEP6809083 (1 lines)
2025-12-01 15:12:59,384 - INFO - [413/468] Processing PO: OEP6809084 (1 lines)
2025-12-01 15:12:59,539 - INFO - [414/468] Processing PO: OEP6809085 (1 lines)
2025-12-01 15:12:59,708 - INFO - [415/468] Processing PO: OEP6809086 (1 lines)
2025-12-01 15:12:59,861 - INFO - [416/468] Processing PO: OEP6809092 (1 lines)
2025-12-01 15:13:00,016 - INFO - [417/468] Processing PO: OEP6809093 (1 lines)
2025-12-01 15:13:00,176 - INFO - [418/468] Processing PO: OEP6809094 (1 lines)
2025-12-01 15:13:00,337 - INFO - [419/468] Processing PO: OEP6809096 (1 lines)
2025-12-01 15:13:00,488 - INFO - [420/468] Processing PO: OEP6809097 (1 lines)
2025-12-01 15:13:00,652 - INFO - [421/468] Processing PO: OEP6810003 (1 lines)
2025-12-01 15:13:00,837 - INFO - [422/468] Processing PO: OEP6810036 (1 lines)
2025-12-01 15:13:01,008 - INFO - [423/468] Processing PO: OEP6810038 (1 lines)
2025-12-01 15:13:01,196 - INFO - [424/468] Processing PO: OEP6810043 (1 lines)
2025-12-01 15:13:01,378 - INFO - [425/468] Processing PO: OEP6810044 (1 lines)
2025-12-01 15:13:01,543 - INFO - [426/468] Processing PO: OEP6810045 (1 lines)
2025-12-01 15:13:01,710 - INFO - [427/468] Processing PO: OEP6810046 (1 lines)
2025-12-01 15:13:01,884 - INFO - [428/468] Processing PO: OEP6810047 (1 lines)
2025-12-01 15:13:02,043 - INFO - [429/468] Processing PO: OEP6810048 (1 lines)
2025-12-01 15:13:02,218 - INFO - [430/468] Processing PO: OEP6810049 (1 lines)
2025-12-01 15:13:02,390 - INFO - [431/468] Processing PO: OEP6810056 (1 lines)
2025-12-01 15:13:02,591 - INFO - [432/468] Processing PO: OEP6810062 (1 lines)
2025-12-01 15:13:02,781 - INFO - [433/468] Processing PO: OEP6810063 (1 lines)
2025-12-01 15:13:02,953 - INFO - [434/468] Processing PO: OEP6810066 (1 lines)
2025-12-01 15:13:03,130 - INFO - [435/468] Processing PO: OEP6810067 (1 lines)
2025-12-01 15:13:03,308 - INFO - [436/468] Processing PO: OEP6810068 (1 lines)
2025-12-01 15:13:03,503 - INFO - [437/468] Processing PO: OEP6810069 (1 lines)
2025-12-01 15:13:03,709 - INFO - [438/468] Processing PO: OEP6810070 (1 lines)
2025-12-01 15:13:03,881 - INFO - [439/468] Processing PO: OEP6810071 (1 lines)
2025-12-01 15:13:04,456 - INFO - Using picking_type_id: คลังสินค้าสำเร็จรูป 1: Receipts (ID: 1)
2025-12-01 15:13:04,793 - INFO - Created PO OEP6810071 with ID 172
2025-12-01 15:13:04,803 - INFO - [440/468] Processing PO: OEP6810072 (1 lines)
2025-12-01 15:13:04,958 - INFO - [441/468] Processing PO: OEP6810073 (1 lines)
2025-12-01 15:13:05,126 - INFO - [442/468] Processing PO: OEP6810074 (1 lines)
2025-12-01 15:13:05,294 - INFO - [443/468] Processing PO: OEP6811001 (1 lines)
2025-12-01 15:13:05,443 - INFO - [444/468] Processing PO: OEP6811003 (1 lines)
2025-12-01 15:13:05,609 - INFO - [445/468] Processing PO: OEP6811020 (1 lines)
2025-12-01 15:13:05,787 - INFO - [446/468] Processing PO: OEP6811021 (1 lines)
2025-12-01 15:13:05,944 - INFO - [447/468] Processing PO: OEP6811027 (1 lines)
2025-12-01 15:13:06,119 - INFO - [448/468] Processing PO: OEP6811028 (1 lines)
2025-12-01 15:13:06,298 - INFO - [449/468] Processing PO: PR5711237 (1 lines)
2025-12-01 15:13:06,459 - INFO - [450/468] Processing PO: PR5801502 (1 lines)
2025-12-01 15:13:06,631 - INFO - [451/468] Processing PO: PR5810240 (1 lines)
2025-12-01 15:13:06,783 - INFO - [452/468] Processing PO: PR5812158/1 (1 lines)
2025-12-01 15:13:06,928 - INFO - [453/468] Processing PO: PR5812158/2 (1 lines)
2025-12-01 15:13:07,082 - INFO - [454/468] Processing PO: PV-6106105 (1 lines)
2025-12-01 15:13:07,251 - INFO - [455/468] Processing PO: SMJV6212023 (1 lines)
2025-12-01 15:13:07,845 - INFO - Using picking_type_id: คลังสินค้าสำเร็จรูป 1: Receipts (ID: 1)
2025-12-01 15:13:08,127 - INFO - Created PO SMJV6212023 with ID 173
2025-12-01 15:13:08,131 - INFO - [456/468] Processing PO: SMJV6212024 (1 lines)
2025-12-01 15:13:08,295 - INFO - [457/468] Processing PO: SMJV6801014 (1 lines)
2025-12-01 15:13:08,449 - INFO - [458/468] Processing PO: SMJV6802001 (1 lines)
2025-12-01 15:13:08,598 - INFO - [459/468] Processing PO: SMJV6803001 (1 lines)
2025-12-01 15:13:08,771 - INFO - [460/468] Processing PO: SMJV6804001 (1 lines)
2025-12-01 15:13:08,917 - INFO - [461/468] Processing PO: SMJV6805001 (1 lines)
2025-12-01 15:13:09,074 - INFO - [462/468] Processing PO: SMJV6806003 (1 lines)
2025-12-01 15:13:09,237 - INFO - [463/468] Processing PO: SMJV6807017 (1 lines)
2025-12-01 15:13:09,422 - INFO - [464/468] Processing PO: SMJV6808007 (1 lines)
2025-12-01 15:13:09,598 - INFO - [465/468] Processing PO: SMJV6809001 (1 lines)
2025-12-01 15:13:09,771 - INFO - [466/468] Processing PO: SMJV6810002 (1 lines)
2025-12-01 15:13:09,941 - INFO - [467/468] Processing PO: SMJV6811004 (1 lines)
2025-12-01 15:13:10,123 - INFO - [468/468] Processing PO: SMPV6810005/2 (1 lines)
2025-12-01 15:13:10,289 - INFO - --------------------------------------------------------------------------------
2025-12-01 15:13:10,289 - INFO - 
================================================================================
2025-12-01 15:13:10,290 - INFO - IMPORT SUMMARY
2025-12-01 15:13:10,290 - INFO - ================================================================================
2025-12-01 15:13:10,291 - INFO - Total POs processed: 468
2025-12-01 15:13:10,303 - INFO - Success rate:        7.1%
2025-12-01 15:13:10,460 - INFO - 
! Error details saved to: Import_PO\logs\po_errors_20251201_151119.xlsx
2025-12-01 15:13:10,461 - INFO - ================================================================================

